Participante,Texto,Sentimiento,Palabras,Dia,Mes,Anio
PREGUNTA," En el marco de la Estrategia Nacional de Seguridad, implementada por el Gobierno de México, se han atendido a los estados con mayor incidencia delictiva, Guerrero entre ellos, en donde el Ejército, la Armada, la Fuerza Aérea y la Guardia Nacional mantienen un despliegue permanente de 12 mil 279 efectivos, con el objetivo de reforzar la seguridad y garantizar el bienestar de sus pobladores.",0.0,64,17,1,2025
PREGUNTA," La problemática en el estado afecta principalmente a los municipios de Acapulco de Juárez, Chilpancingo, Técpan de Galeana, Teloloapan, Zihuatanejo de Azueta, Cuajinicuilapa y Quechultenango.",0.0,25,17,1,2025
PREGUNTA,"Por tal motivo es que, desde el 1o. de octubre de 2024, las fuerzas de seguridad de los tres órdenes de gobierno, en continuidad con las acciones de la anterior administración, llevan a cabo distintas operaciones que dieron como resultado el aseguramiento de: 225 armas de fuego, 38 mil 04 cartuchos, 591 cargadores, 231 vehículos, 2 mil 758 kilogramos de marihuana, 19 mil 460 kilogramos de cocaína, 12 embarcaciones, 243 mil 78 pesos y 346 personas detenidas; entre estas últimas destacan: Eduardo “N”, Germán “N”, Alexander “N”, Adrián “N”, Uriel “N” y Marco “N”.",0.0,94,17,1,2025
PREGUNTA," Aunado a lo anterior, durante el mes de octubre, en el municipio de Técpan de Galeana, el Ejército Mexicano participó en la desarticulación del grupo delictivo “Gente Nueva Guerrerense”, destacándose la detención de 23 personas de nacionalidad guatemalteca y una de nacionalidad salvadoreña, asegurando: 19 vehículos, 3 con blindaje artesanal; 21 armas de fuego, un fusil Barrett calibre 50 milímetros, una ametralladora y 18 artefactos explosivos improvisados.",0.0,67,17,1,2025
PREGUNTA,"En el mismo periodo, la Fiscalía General y la Secretaría de Seguridad Pública del estado de Guerrero llevaron a cabo 24 órdenes técnicas de investigación y 83 órdenes de aprehensión, lo que representa un incremento del 23 por ciento, de octubre a diciembre del 2024.",0.0,45,17,1,2025
PREGUNTA," Por otra parte, el Ejército, la Armada, la Fuerza Aérea y la Guardia Nacional, en coordinación con las instituciones de seguridad en el estado, emprendieron diversas acciones tendientes a garantizar la seguridad y el bienestar de los pobladores y visitantes del puerto de Acapulco, lo que dio como resultado: 87 personas detenidas, el aseguramiento de 44 vehículos y 31 armas de fuego.",0.0,62,17,1,2025
PREGUNTA," En operaciones marítimas, la Armada de México ha asegurado 23.2 toneladas de cocaína, de las cuales, 17.9 corresponden al estado de Guerrero.",0.0,22,17,1,2025
PREGUNTA,"Como parte de ello, en el mes de noviembre, frente a las costas del estado fueron decomisadas 8.3 toneladas de cocaína, con un valor estimado de 2 mil 121 millones de pesos. Se trata de una operación sin precedentes para la Armada de México y que afecta económicamente a los presuntos infractores de la ley.",0.0,55,17,1,2025
PREGUNTA," Asimismo, en coordinación con los tres órdenes de gobierno, la Guardia Nacional implementó la estrategia turística “Vacaciones 2024”, gracias a la cual no se registraron incidentes de relevancia para los vacacionistas en la entidad.",0.0,34,17,1,2025
PREGUNTA," Anteponiendo siempre la salvaguarda y el bienestar de la vida humana en el mar, se rescató a 21 personas que se encontraban en peligro y brindó apoyo a tres embarcaciones.",0.0,30,17,1,2025
PREGUNTA," Además, a fin de mitigar el impacto de los fenómenos hidrometeorológicos, se llevó a cabo el dragado de 36 mil 250 metros cúbicos de ríos y arroyos, así como el desazolve de áreas inundadas, extrayendo un volumen de 137 mil 500 metros cúbicos de agua.",0.0,45,17,1,2025
PREGUNTA," Gracias a todas estas acciones en el estado de Guerrero, entre los meses de septiembre y diciembre de 2024, se logró la reducción de los delitos de alto impacto en un 5 por ciento y un 15.7 por ciento en el delito de homicidio doloso; destaca también que, en Acapulco, disminuyeron 4.6 por ciento los delitos de alto impacto y 50.6 por ciento el delito de homicidio doloso, en este mismo periodo.",0.0,72,17,1,2025
PREGUNTA,"Además, sobresale el decremento de los siguientes delitos de alto impacto en la entidad: 50 por ciento en secuestro, 7.3 por ciento en extorsión, 25 por ciento en robo de vehículos y 14.2 por ciento en robo con violencia.",0.0,39,17,1,2025
PREGUNTA, La presente estrategia refleja en sus acciones el compromiso del Gobierno de México con su gente.,0.0,16,17,1,2025
PREGUNTA, Unidos por un México en paz y seguro.,0.0,8,17,1,2025
PREGUNTA, Gobierno de México.,0.0,3,17,1,2025
PREGUNTA,(FINALIZA VIDEO),0.0,2,17,1,2025
PREGUNTA,(INICIA VIDEO DE LA ESTRATEGIA NACIONAL POR LA PAZ EN EL ESTADO DE GUERRERO),0.0,14,17,1,2025
PREGUNTA," Como parte de la reconstrucción en el estado de Guerrero, el Gobierno de México ha puesto especial énfasis en la restauración del tejido social. Por ello, brigadistas de alrededor de 40 dependencias y organismos de los tres niveles de gobierno recorren casa por casa en los municipios de Chilpancingo y Acapulco. El objetivo es garantizar condiciones de bienestar y prosperidad de las comunidades.",0.0,63,17,1,2025
PREGUNTA,"Mediante la Estrategia Nacional por la Paz, se fortalece el acercamiento de más de 100 programas sociales y servicios. En la entidad más de 500 brigadistas, entre el 3 de diciembre de 2024 y el 10 de enero de este año, han visitado 12 mil 751 hogares, entrevistando a 8 mil 361 personas.",0.0,53,17,1,2025
PREGUNTA,"Tan solo en Chilpancingo, se ha ido a 32 colonias prioritarias y barrios. Además, se han conformado Comités y Ferias de Paz, y se han implementado “Senderos de Paz”.",0.0,29,17,1,2025
PREGUNTA,"En Acapulco se han recorrido, tocando puerta por puerta, las colonias prioritarias de: Emiliano Zapata, Postal y Progreso.",0.0,18,17,1,2025
PREGUNTA,"Entre los programas y servicios ofrecidos se encuentran: medicina preventiva, salud mental, instalación de chips de la Comisión Federal de Electricidad, información sobre extorsión y fraudes.",0.0,26,17,1,2025
PREGUNTA,"Asimismo, se reforzaron acciones de prevención de las violencias y las adicciones en escuelas.",0.0,14,17,1,2025
PREGUNTA,"También, como parte de la atención integral en estos municipios, se facilita la inscripción al programa Jóvenes Construyendo el Futuro.",0.0,20,17,1,2025
PREGUNTA,"En las Ferias de Paz se han brindado más de 7 mil atenciones y se han conformado SEIS Comités de Paz y tres asambleas, acciones en las que ha participado la autoridad estatal.",0.0,33,17,1,2025
PREGUNTA,"Como parte de la estrategia, se invita a la población de todas las edades, en especial a niñas, niños, adolescentes y jóvenes a integrarse en estas actividades.",0.0,27,17,1,2025
PREGUNTA,"Los gobiernos humanistas tienen el compromiso de mejorar las condiciones de vida. Y en ese sentido, el gobierno de la Presidenta Claudia Sheinbaum, trabaja en favor del pueblo de México.",0.0,30,17,1,2025
PREGUNTA, Gobierno de México.,0.0,3,17,1,2025
PREGUNTA,(FINALIZA VIDEO),0.0,2,17,1,2025
PREGUNTA,"Y en materia de seguridad para Acapulco, si ¿se prevé alguna Operación Enjambre? No sé si el secretario de Seguridad pudiera explicarnos o si se va a ampliar la seguridad en algún sentido, también, de manera paralela a lo que ayer se anunció.",0.0,43,17,1,2025
PREGUNTA,"Y preguntarle, por otro lado: ya el lunes asume Donald Trump la presidencia de Estados Unidos. Usted ha dicho que habrá buena relación. Si nos pudiera detallar un poco más el plan eventualmente ante deportaciones masivas, si, ¿se va a ofrecer trabajo a los mexicanos, si va a haber programas sociales, en fin? ¿Cómo se podría enfrentar esta situación, particularmente, en la frontera?",0.0,63,17,1,2025
PREGUNTA,"¿Y si ya se logró hablar con presidentes de otros países para que ciudadanos de otras naciones, como es Centroamérica, sean deportados directamente a sus países de origen?",0.0,28,17,1,2025
PREGUNTA,"Una de las obras importantes de la administración pasada, del Presidente Andrés Manuel López Obrador, fue sin duda la carretera federal 200, una magnífica carretera que conecta desde Las Vigas hasta Cuajinicuilapa, como se comprometió el Presidente a hacerlo, y lo cumplió bien.  Faltan puentes, faltan algunas cosas.",0.0,48,17,1,2025
PREGUNTA,"Pero hay un problema, un problema grave en este tramo de carretera que va desde Cuajinicuilapa a Puerto Escondido que, realmente está afectadísima, afectadísima por los baches provocados por las lluvias de los fenómenos que tuvimos últimamente.",0.0,37,17,1,2025
PREGUNTA,"Entonces, creo que hace falta una intervención ahí, porque al programa de Bachetón se le vio nada más como ocho días después de ser anunciado y ya de ahí desapareció. Entonces, el tramo es difícil para la gente que camina por ahí.",0.0,42,17,1,2025
PREGUNTA,"Otro tema también que veo en el CIP, que anunciaron ayer, es que no toca el asunto de las playas privadas en Acapulco. Los hoteleros de Acapulco, sobre todo, la parte que va desde Diamante, Revolcadero, hasta el Papagayo, están privatizadas.",0.0,41,17,1,2025
PREGUNTA,"Había accesos aceptados por la autoridad, como al menos unos 10 accesos públicos para las playas de la gente, acapulqueños; ya están cerrados, embardados. Alguna vez hubo un intento del Ayuntamiento de Acapulco por liberarlo y llegaron inmediatamente ciudadanos civiles a cerrarlo; así, de ese nivel.",0.0,46,17,1,2025
PREGUNTA,"Entonces, yo creo que hace falta la intervención en hablar de ese tema, de la privatización de las playas, a las cuales la gente pobre no tiene acceso. Diamante es para los dueños de los edificios que están ahí, incluso, muchos edificios no tienen ni plantas de tratamiento.",0.0,48,17,1,2025
PREGUNTA,"Bueno, quisiera cambiar un poquito la parte más radical y preguntarle algo más a usted, personal: el sábado en el centro de la Ciudad de México, en el Zócalo de la Ciudad de México, va a cantar uno de los íconos de la canción latinoamericana y del rock, que es Fito Páez, y que además, tiene temas importantes que han acompañado la lucha de la izquierda por toda la vida, como Yo vengo a ofrecer mi corazón, que se cantó en varias derrotas, después de los fraudes electorales.",0.0,88,17,1,2025
PREGUNTA,"Usted no va a estar ahí, creo, porque va a andar por acá con nosotros.",0.0,15,17,1,2025
PREGUNTA,"¿Qué piensa de Fito, y qué piensa de la presentación de Fito Páez ahí, en el Zócalo de la ciudad?",0.0,20,17,1,2025
PREGUNTA,Muchas gracias. Y disculpe.,0.0,4,17,1,2025
PREGUNTA,"En primer lugar, preguntarle: ¿Qué reporte tiene el Gabinete de Seguridad sobre ataques a tres bares en Morelia esta madrugada?",0.0,20,17,1,2025
PREGUNTA,"Presidenta, aprovechando que está la consejera jurídica, no sé, ¿si nos pueda dar un corte de caja de cómo va este proceso de selección de los candidatos, del Comité de Evaluación del Poder Ejecutivo?",0.0,34,17,1,2025
PREGUNTA,"Y también, ¿si nos puede dar detalles acerca de la reunión que tuvieron ayer con ministros de la Suprema Corte.",0.0,20,17,1,2025
PREGUNTA,"Quisiera preguntarle primero sobre el “Maribús”, que nos… Bueno, yo sé que a lo mejor puede ser un proyecto a largo plazo, pero que nos pudiera ayudar si se tienen esos datos. Por ejemplo: ¿cuánto va a costar el uso de este nuevo transporte?",0.0,44,17,1,2025
PREGUNTA,"¿Y cómo sería utilizarlo?, dado el caso que el transporte vía terrestre sufre de violencia, hay quema de vehículos. Entonces, ¿cómo sería este nuevo uso?",0.0,25,17,1,2025
PREGUNTA,"Y me gustaría también precisar la pregunta que hizo la compañera sobre lo del Operativo Enjambre: ¿si es necesario, si es viable llevarse a cabo aquí en el estado de Guerrero?",0.0,31,17,1,2025
PREGUNTA,"Traerle el sincero cariño y agradecimiento del pueblo de Guerrero y de Acapulco porque, a pesar de las adversidades, usted nunca nos ha dejado solos. Mencionan que junto con al Presidente AMLO han sido los mejores en la historia del país.",0.0,41,17,1,2025
PREGUNTA,"Preguntarle de la coordinación que ha tenido con la gobernadora guerrerense, Evelyn Salgado Pineda, primera mujer en la historia de administrar la entidad, igual que usted en el país: ¿si seguirá la coordinación permanentemente, como ha estado ha estado ahora, sobre todo, con el plan anunciado ayer, y con la alcaldesa Abelina López Rodríguez, para seguir con la reconstrucción de Acapulco? Debido a que, pese a ser el primer destino turístico de talla mundial en México, por muchos años estuvo en el abandono de las autoridades federales.",0.0,87,17,1,2025
PREGUNTA,Es la primera pregunta.,0.0,4,17,1,2025
PREGUNTA,"Mi segunda pregunta, Presidenta es: es bien sabido que el rector de la Universidad Autónoma de Guerrero, Javier Saldaña Almazán, fue el primero que la apoyó a usted, incluso, desde antes de que usted fuera precandidata.",0.0,36,17,1,2025
PREGUNTA,"¿Saber si habrá un presupuesto adicional a estas universidades?, que son muy importantes porque son las que de las comunidades de los pueblos más alejados tienen la oportunidad de asistir a una institución de nivel superior.",0.0,36,17,1,2025
PREGUNTA,"¿Saber si habrá un presupuesto adicional a esta universidad? Una de las más sólidas del país, la cual busca incrementar su matrícula y que entre sus particularidades es que siempre se ha caracterizado por ser de izquierda.",0.0,37,17,1,2025
PREGUNTA,Esa es mi segunda pregunta.,0.0,5,17,1,2025
PREGUNTA,"Por último, nada más, agradecerle en especial, la mamá del niño Carlitos, del ISSSTE. Ella aquí en una “Mañanera” le externamos al Presidente López Obrador que le habían suspendido una vacuna, que ya estaba aprobada y que el presupuesto para esta vacuna había desaparecido; el Presidente instruyó que se le aplicará la vacuna, con un valor alrededor de 3 millones de pesos. Hasta este momento le han puesto más de 28 millones de pesos.",0.0,74,17,1,2025
PREGUNTA,"Su mamá, Gabi, está eternamente agradecida con usted y con el Presidente.",0.0,12,17,1,2025
PREGUNTA,Y preguntarle: ¿cómo será la continuación de la Transformación en el sistema de salud en Guerrero y en el país?,0.0,20,17,1,2025
PREGUNTA,"Muchas gracias, señora Presidenta. Buenos días.",0.0,6,17,1,2025
PREGUNTA,"Presidenta, yo le quiero preguntar: ¿cuál es su opinión acerca de que el senador Félix Salgado Macedonio afirmó que va a apoyar la reforma electoral que usted está presentando sobre la situación del nepotismo, para que se hereden cargos?",0.0,39,17,1,2025
PREGUNTA,"Él dice que va a votar a favor, aunque a sus simpatizantes que tendrá efecto hasta el 2030. Yo quiero saber ¿cuál es su opinión respecto a esto?",0.0,28,17,1,2025
PREGUNTA,"Y la otra pregunta que tengo, Presidenta, es: ¿cuáles son los avances en la búsqueda de los 43 normalistas? Los padres han estado insistiendo en que se diga, se dé el informe por parte del Ejército. Preguntarle: ¿cuáles son los avances?, ¿ya el Ejército le dio alguna información respecto a lo que están solicitando los padres?",0.0,56,17,1,2025
PREGUNTA,"Y la otra es, la otra pregunta, Presidenta, es usted en días recientes había comentado acerca del decreto del outsourcing, preguntarle: ¿si nos puede decir en qué consiste esta situación?",0.0,30,17,1,2025
PREGUNTA,"Sin duda alguna el proyecto que más ha impactado en Acapulco es el “Maribús”. Digo, es algo que ya había sido antes planteado por el exgobernador Ángel Aguirre Rivero en el 2013.",0.0,32,17,1,2025
PREGUNTA,"Preguntarle, Presidenta: ¿cuánto es el monto de esta inversión, y si va a hacer pública, privada, mixta?, ¿y para cuándo se tiene planeado que inicie ya sus operaciones?",0.0,28,17,1,2025
PREGUNTA,"Una última pregunta, secretaria, digo, Presidenta, perdón: en los proyectos que presentó ayer ¿si tiene considerado a algún proyecto de cuidado al medio ambiente? Porque muchos biólogos locales han denunciado el blanqueamiento de los corales; y, bueno, y la fauna, y la flora de Acapulco fue devastada.",0.0,47,17,1,2025
PREGUNTA,Preguntarle: ¿si tiene…?,0.0,3,17,1,2025
PREGUNTA,"Preguntarle ¿si hay algún proyecto de desarrollo —no sé— agrícola, algo específico para el rescate de la zona rural de Acapulco?",0.0,21,17,1,2025
PREGUNTA,"Preguntarle, regresando un poco a la elección del Poder Judicial, ¿desde el Gobierno Federal se tiene estimada aproximadamente la participación de la gente el día de la elección?",0.0,28,17,1,2025
PREGUNTA,"También, ¿si el Gobierno Federal podrá promover que la gente vaya y vote ese día?",0.0,15,17,1,2025
