Participante,Texto,Sentimiento,Palabras,Dia,Mes,Anio
PREGUNTA," Muchas gracias, Presidenta. Muy buenos días.",0.0,6,12,2,2025
PREGUNTA,"Bueno, aprovechando que están aquí el director de Pemex y la secretaria de Energía, me gustaría saber si, ¿en toda esta reestructuración…?",0.0,22,12,2,2025
PREGUNTA,"Primero, me presento, perdón, soy Olga Ojeda Lajud, soy corresponsal del Diario del Istmo y de Imagen de Veracruz, que pertenecen al corporativo Imagen del Golfo.",0.0,26,12,2,2025
PREGUNTA,"Ahora sí, voy con mi pregunta: si toda esta reestructuración que se está haciendo a Pemex ¿contempla recorte de personal?, ¿cuál va a ser la forma?, porque se ha visto que con todo esto de la deuda de Pemex ha habido recorte en algunas zonas; creo que los más afectados, Campeche y Tabasco.",0.0,53,12,2,2025
PREGUNTA,"Pero quisiera saber su punto de vista si, ¿sí va a haber recorte de personal?",0.0,15,12,2,2025
PREGUNTA," Ok, muchas gracias, Presidenta.",0.0,4,12,2,2025
PREGUNTA,"Y, por otro lado, en un tema también de Veracruz: sabemos que es parte estratégico Veracruz del programa o del Plan México.",0.0,22,12,2,2025
PREGUNTA,"Entonces, me gustaría saber. Hay un proyecto que tiene ya muchos años: la Hidroeléctrica El Naranjal. Este proyecto planea o se planea estar construido en la mitad de su administración. Quisiera saber si ¿nos puede adelantar un poco más sobre el tema, si tienen planes?",0.0,45,12,2,2025
PREGUNTA, Heraldo Media Group.,0.0,3,12,2,2025
PREGUNTA,"¿De qué manera con este plan, Presidenta, se va a atender la deuda financiera y la deuda a los proveedores? Mencionaba que no va a haber despidos y que va a haber una atención en la burocracia, pero ¿cómo se van a atender la deuda financiera, que es grande, y la deuda a los proveedores?",0.0,55,12,2,2025
PREGUNTA, Grupo Transmedia La Chispa.,0.0,4,12,2,2025
PREGUNTA,"Preguntarle en primera instancia, Presidenta: el día de ayer en la Cámara, el Grupo Parlamentario del PAN busca una disminución del 50 por ciento al IEPS en cuanto a las gasolinas para disminuir el costo de gasolinas.",0.0,37,12,2,2025
PREGUNTA,"Dicen que con esto van a apoyar al gasto de las familias; sin embargo, hay algo que parece que no recuerdan, parece que se les olvidó, que durante el gobierno de Felipe Calderón fue cuando se dieron los “gasolinazos”, y ahora, quieren poner un freno a supuestamente… No sé cuál sería. Ahora que ellos ya no gobiernan, ahora que ya no están en la administración, pues ahora quieren decir que ellos están trabajando.",0.0,73,12,2,2025
PREGUNTA,"No sé si podemos conocer su opinión, Doctora.",0.0,8,12,2,2025
PREGUNTA,"Y, bueno, aprovechando la presencia del director de Pemex: pues ya que se han dado a conocer que se han estado avanzando en cuanto a algunos proveedores de Pemex, específicamente en la Plataforma Pol-Alfa, que pertenece a la Subdirección de Producción de Región Marina Sureste, pues precisamente, en esta plataforma se han estado infringiendo el contrato, los contratos hacia los trabajadores. Y de hecho, los trabajadores entraron en huelga de hambre desde ayer, antier.",0.0,74,12,2,2025
PREGUNTA,Ayer en Transmedia se publicó la nota. Si nos pudiera comentar.,0.0,11,12,2,2025
PREGUNTA," Ok, muchísimas gracias. Gracias, Presidenta.",0.0,5,12,2,2025
PREGUNTA,"Y, bueno, finalmente, conocer su opinión tras el nombramiento de Terry Cole, exjefe regional en México como nuevo director de la DEA, ya que analistas internacionales advierten que hay un riesgo de alguna injerencia del presidente estadounidense. Sin embargo, usted ha estado reiterando en numerosas ocasiones que, bueno, hay plática y usted ha estado pugnando por la soberanía, ¿no?",0.0,59,12,2,2025
PREGUNTA, Radio Resultados.,0.0,2,12,2,2025
PREGUNTA,"Preguntarle, principalmente, sobre lo que se ha presentado hoy, hablaban de perforaciones focalizadas. Me llama la atención que no aparece en el mapa que presentó el director de Pemex, el norte de Veracruz, cuando fue durante muchos años la capital petrolera de México, Poza Rica, no aparece en perforaciones focalizadas. No sé si, ¿cuál sea la razón por la que no…?, porque es una zona que, prácticamente, siempre ha sido muy productiva en petróleo.",0.0,74,12,2,2025
PREGUNTA,"Gracias, director.",0.0,2,12,2,2025
PREGUNTA,"Hablaba también el director sobre aprovechar el gas que hay en todas estas zonas petroleras, hay quemadores que han iluminado los campos durante muchos años. ¿Qué posibilidades hay de que, en lugar de que se queme, digo, proponen ustedes hacer cambios, ese gas no se puede usar como combustible para la industria o el uso doméstico?",0.0,56,12,2,2025
PREGUNTA,"Presidenta, usted respondía, a mi compañera hace unos momentos, de que no habrá recorte de personal, pero en los pasillos de Pemex se habla de que —y algunos medios lo publican— de que habrá un 5 por ciento de despidos en personal de confianza. Usted decía que no habrá.",0.0,49,12,2,2025
PREGUNTA,"¿Esto, cómo puede homologarse o equilibrarse un poco para que no sea tanta la diferencia entre el de confianza y el sindicalizado?",0.0,22,12,2,2025
PREGUNTA, Reuters.,0.0,1,12,2,2025
PREGUNTA,"Yo quería preguntarle varias cosas y una de ellas es ―a usted o al director general de Pemex― que, si bien, es cierto que la meta de producción es de 1.8 barriles por día con crudo y condensado, las propias cifras de Pemex están arrojando que estamos por debajo de ese nivel, y que además en el caso de solamente crudo la producción está en niveles de 1.3...",0.0,68,12,2,2025
PREGUNTA," farm-out, de alguna manera? En donde, bueno, dice la legislación ahí que Pemex no va a tener que poner el capital, pero sí tiene, es dueña del área.",0.0,28,12,2,2025
PREGUNTA,¿Qué tan pronto van ustedes a hacer este tipo de asociaciones para poder moverse lo más rápido posible para tratar de elevar la producción?,0.0,24,12,2,2025
PREGUNTA,"No estaba diciendo que estaban contabilizando mal, sino las mismas cifras de Pemex están dando cuenta que toda esa sumatoria igual bajó un 4 por ciento en 2024 respecto al 2023, y eso es una realidad, ¿no? Por eso me pregunto: ¿qué tan rápido se van a mover?",0.0,48,12,2,2025
PREGUNTA, Ok.,0.0,1,12,2,2025
PREGUNTA,"Otra pregunta: la semana pasada usted se refirió en dos oportunidades a los problemas que tenía Dos Bocas, por un problema de salinidad del crudo, pero hay reportes de que, efectivamente, el problema de salinidad podía ser más allá de solamente el tema de Dos Bocas. Y mi pregunta es concretamente si, ¿está teniendo Pemex problemas de agua y salinidad en el crudo?, ¿si eso está afectando las exportaciones?",0.0,69,12,2,2025
PREGUNTA, y Kunah dentro de toda su operación.,0.0,7,12,2,2025
PREGUNTA,"El ingeniero Slim el otro día admitió que ese proyecto es complejo, pero no dio más detalles.",0.0,17,12,2,2025
PREGUNTA,"Me pregunto: si esto es así, ¿bajo qué modalidad se está manejando, si van a modificar el contrato de servicio que tiene actualmente o habría otro contrato de servicio, o cómo van a actuar aquí respecto a este proyecto que ya fracasó dos veces antes?",0.0,45,12,2,2025
PREGUNTA,"Me pregunto si, usted, ¿nos podría dar un poco más de precisiones?, porque algunos contratistas lo que dicen es que se pagó poquito, esa deuda es de 20 mil 500 millones de dólares más o menos, pero entendemos, fue de la administración pasada, que había muchas cosas en litigio. ¿Se va a quedar así?",0.0,54,12,2,2025
PREGUNTA,"La administración pasada a veces explicó que ese monto contenía muchas deudas muy viejas que no se habían podido comprobar y que estaban muchas en litigio, pero nunca se dice qué es lo que está en litigio o lo que está problemático y lo que es la deuda.",0.0,48,12,2,2025
PREGUNTA,"Entonces, yo me pregunto si ¿ustedes ya tienen desagregado cuánto es esa deuda con proveedores, la que está documentada y la que se va a pagar? O sea, ¿tienen un monto, no sé, de cuánto de miles de dólares, si lo pueden precisar?",0.0,43,12,2,2025
PREGUNTA," Acapulco al Tanto, Guerrero.",0.0,4,12,2,2025
PREGUNTA,"A mí se me hace complicado como reportero entender a veces todas las cifras, números que se hablan.",0.0,18,12,2,2025
PREGUNTA,"Me gustaría que la gente de Pemex me explicara un poquito o nos explicara tal vez con manzanas ¿cuál es el objetivo final de este plan para Pemex?, ¿y qué lo hace diferente de otros?, ¿y a dónde se pretende llegar? Yo creo que sería necesario para que la gente, la gran mayoría lo entendiera.",0.0,55,12,2,2025
PREGUNTA,Y tengo otras preguntas para ustedes.,0.0,6,12,2,2025
PREGUNTA, Mi siguiente pregunta es…,0.0,4,12,2,2025
PREGUNTA,"La siguiente pregunta tiene que ver con las dos iniciativas que lanzó usted y que ahorita están en las comisiones del Senado, que es la de antirreeleccionista y la del nepotismo.",0.0,31,12,2,2025
PREGUNTA,"Conociendo los estados del sur, por ejemplo, específicamente, Guerrero y Oaxaca, hay una tradición en la clase política de todos los partidos de: colocar a familiares en diversos puestos. Tenemos familias en Guerrero, por ejemplo, que llevan 20 años en el poder, han pasado la presidencia municipal de uno a otro, a un hijo, a una esposa, equis, equis; igualmente, los diputados también.",0.0,63,12,2,2025
PREGUNTA,"Entonces, viendo esta situación, conociendo esta realidad, ¿usted no vio o puede ver que tal vez las iniciativas no pasen en estos Congresos locales donde hay intereses de grupos donde están amafiados familias?",0.0,33,12,2,2025
PREGUNTA, Bloomberg Línea.,0.0,2,12,2,2025
PREGUNTA,"Quisiera preguntarle sobre el financiamiento que será completado con recursos privados, si ¿nos puede dar detalles sobre los proyectos y el dinero que esperan?, y si, ¿esto evitará que Pemex vaya a los mercados el resto del sexenio?",0.0,38,12,2,2025
PREGUNTA," Diario Basta, Tabasco Hoy, Campeche Hoy y Quintana Roo Hoy, de Grupo Cantón.",0.0,13,12,2,2025
PREGUNTA,"Primero, nada más para que quede, digamos, claro: no se ha mencionado o se ha tocado de manera muy superficial, todo el daño que dejó la corrupción, precisamente, a Pemex. Se habla aquí de cifras, de datos, de estadísticas, pero también se ha dejado de lado todo esto que han venido ustedes de alguna manera marchando a contracorriente.",0.0,58,12,2,2025
PREGUNTA,"Recordar que el Presidente Andrés Manuel López Obrador toma una industria, prácticamente, en ruinas, chatarra, se hace una inversión muy fuerte. Entonces, sí, de alguna manera que se deje en claro los daños que dejó la corrupción.",0.0,37,12,2,2025
PREGUNTA,¿A cuánto ascendió la corrupción el daño que operó en Pemex?,0.0,11,12,2,2025
PREGUNTA,"¿Cuántos fueron los contratos —que bueno, ahí quedó pendiente esa promesa del Presidente― de los que echaron para atrás?",0.0,19,12,2,2025
PREGUNTA,"Y que, bueno, ya algunos ya habían, incluso, a presentar denuncias penales, precisamente, por toda esta ola de corrupción que imperó durante los sexenios de Felipe Calderón y Enrique Peña Nieto.",0.0,31,12,2,2025
PREGUNTA,"Dice que —según esto, de Transparencia Internacional— dice que México descendió al lugar 140 de 180 países, según esto, lo que da a conocer este estudio.",0.0,26,12,2,2025
PREGUNTA,"Lo que llama la atención de estos análisis que están haciendo en medios de comunicación, analistas políticos, todo lo que es parte de esta retórica de quienes dicen ser “agoreros del fracaso”, no se menciona todo lo que el Presidente Andrés Manuel López Obrador estuvo trabajando a lo largo de este sexenio.",0.0,52,12,2,2025
PREGUNTA,"Se habla de que cayó 14 lugares, del lugar … Ahorita le comento, es que estaba viendo aquí el estudio.",0.0,20,12,2,2025
PREGUNTA,"Bueno, quería referirme a lo siguiente: se habla de caída de 14 lugares, pero lo que no mencionan es que con Vicente Fox la caída de la corrupción fue de 11 lugares, con Felipe Calderón fue de 35 lugares y con Enrique Peña Nieto 33 lugares.",0.0,46,12,2,2025
PREGUNTA,"Pero lo que no mencionan aquí —y es algo que sí quisiera yo destacar, porque es parte de un análisis que hicimos aquí en Grupo Cantón— es que en 18 años, durante tres sexenios, México retrocedió 79 lugares en el Índice de Percepción de Corrupción, esto fue en las administraciones neoliberales del PRI y del PAN, en donde, aquí hay otro punto que no se toma en cuenta:",0.0,68,12,2,2025
PREGUNTA,"Durante estas dos, bueno, lo que fue la administración del Presidente Andrés Manuel López Obrador y de lo que va, hubo transparencia, siempre se dieron a conocer todos los casos, y ninguno de estos presidentes daba rendición diaria de cuentas, en este caso, al pueblo de México.",0.0,47,12,2,2025
PREGUNTA,"Cuando ahorita, precisamente, lo que es el bloque de oposición celebra: “Ah, cayeron 14 lugares”, pero precisamente en este estudio decía: “Se mantuvo México constante, digamos, en un lugar”.",0.0,29,12,2,2025
PREGUNTA,"Quisiera preguntarle: ¿su reflexión a través de este análisis un poco rápido, un poco simple, pero sí dejando en claro que en 18 años México cayó 79 lugares?",0.0,28,12,2,2025
