Participante,Texto,Sentimiento,Palabras,Dia,Mes,Anio
PREGUNTA, Bien. ¿Y usted?,0.0,3,28,2,2025
PREGUNTA, La vivienda adecuada ya es un derecho humano para las y los mexicanos.,0.0,13,28,2,2025
PREGUNTA,"En este sexenio, a través del Programa de Vivienda para el Bienestar, construiremos un millón de viviendas nuevas, haremos 450 mil mejoramientos y otorgaremos un millón de escrituras.",0.0,28,28,2,2025
PREGUNTA,"¡Este proyecto histórico ya arrancó! Comenzamos en Los Cabos, Baja California Sur, en este estado la meta es de 37 mil viviendas; en Sonora se dio el banderazo de obras de más de 33 mil casas, iniciamos en Ciudad Obregón; y en Yucatán se colocó la primera piedra en el municipio de Tekax, aquí se proyectan realizar 19 mil 500 casas.",0.0,61,28,2,2025
PREGUNTA,"Este programa prioriza a mujeres jefas de familia, madres solteras, comunidades indígenas, jóvenes y personas con discapacidad.",0.0,17,28,2,2025
PREGUNTA,"Juntos y juntas garantizamos el bienestar, a través de una vivienda adecuada.",0.0,12,28,2,2025
PREGUNTA,"Respecto a este acuerdo histórico con empresarios gasolineros, ¿qué posibilidad hay de que se fije el costo de la gasolina magna, más allá de estos seis meses que se acordaron de manera inicial?",0.0,33,28,2,2025
PREGUNTA,Y si ¿se dará una lista de las empresas que no se sumaron a este acuerdo?,0.0,16,28,2,2025
PREGUNTA,"En otro tema, quisiera preguntarle: ¿a qué acuerdos se llegaron ayer en las dos reuniones que se sostuvieron en Estados Unidos, el secretario de Economía, Marcelo Ebrard, con Jamieson Greer, representante comercial de Estados Unidos, así como el canciller Juan Ramón de la Fuente, el secretario Omar García Harfuch y el fiscal general Gertz Manero con Marco Rubio?, ¿a qué acuerdo llegaron, si hay alguna noticia?",0.0,66,28,2,2025
PREGUNTA," ¿No nos podría dar un avance, Presidenta?",0.0,7,28,2,2025
PREGUNTA," Sobre el mismo tema de Estados Unidos, quería preguntarle si ¿hay alguna respuesta respecto a la solicitud de llamada que se hizo para el presidente Donald Trump?",0.0,27,28,2,2025
PREGUNTA, ¿Será una llamada o ya se acordó una reunión física?,0.0,10,28,2,2025
PREGUNTA," Una última pregunta, Presidenta: ¿qué resultados hay en la mesa de ayer que se realizó con la CNTE en la SEP respecto a la reforma de la Ley del Infonavit?",0.0,30,28,2,2025
PREGUNTA," Okey, Presidenta. Muchas gracias.",0.0,4,28,2,2025
PREGUNTA," Gracias, Presidenta. Muy buenos días. Julio Omar Gómez, de Medios Digitales del Pacífico, Sin puntos ni comas y de julioomargs.com.",0.0,20,28,2,2025
PREGUNTA,"Presidenta, muy aplaudido este gran programa de vivienda a nivel nacional.",0.0,11,28,2,2025
PREGUNTA,"Si bien, es cierto, algunas veces el estado de Baja California no está sobrerrepresentado, pero está muy representado con un servidor. Y precisamente, en esto que arranca en Baja California Sur nos da muchísimo gusto, mis paisanos están muy contentos; y claro que, por supuesto, lo acabamos con el gobernador Víctor Castro, que también está muy contento por ello. Y a través de un servidor le extenso esta felicitación.",0.0,69,28,2,2025
PREGUNTA,"Presidenta, también a esto se suma el resultado, del resultado del esfuerzo en conjunto con los tres niveles de gobierno, claro, Presidenta, la buena coordinación que ahora existe en el tema de seguridad en Los Cabos, con el alcalde Christian; y ha colocado el destino turístico como uno de los favoritos y de los más seguros para los turistas nacionales e internacionales, así lo da a conocer obviamente datos del Inegi, en el sexto lugar.",0.0,75,28,2,2025
PREGUNTA,"Y no es por presumir, pero, Presidenta, es uno de los estados más extraordinarios que tiene nuestro país, y por ello, particularmente…",0.0,22,28,2,2025
PREGUNTA,"¿Qué acciones, Presidenta, aparte en relación a este tema, su gobierno se sumará para garantizar que este hermoso destino siga y continúe estando así, o que gane aún mejor posición todavía?",0.0,31,28,2,2025
PREGUNTA,"Presidenta, hemos recibido ya innumerables denuncias sobre servidores de la nación, y es que para que se pudiera revisar en este asunto, pues que se encuentran algunos de estos servidores cansados, dicen que hay explotación de jornadas laborales de más de 12 horas de lunes a domingo, los pagos se atrasan.",0.0,51,28,2,2025
PREGUNTA,"Comentan que existen ciertas amenazas y que no hay días de descanso ni vacaciones, y que precisamente es por el exhaustivo trabajo de comprobar resultados en base a los objetivos que tienen planteados.",0.0,33,28,2,2025
PREGUNTA,"Entonces, sí pedirían ellos que si pudieran revisar estos asuntos. ¿Cómo se está trabajando con los servidores de la nación?",0.0,20,28,2,2025
PREGUNTA," Muchas gracias. Yo creo que esa es una excelente noticia, el aumento.",0.0,12,28,2,2025
PREGUNTA,"Oiga, Presidenta, la pregunta es sobre los Consulados: ¿Se cobra algo por hacer citas ahí en los Consulados?",0.0,18,28,2,2025
PREGUNTA," Claro. Le quiero poner un ejemplo, porque nos han llegado muchas denuncias de este tipo, es sobre que les agendan citas.",0.0,21,28,2,2025
PREGUNTA, Coyotaje.,0.0,1,28,2,2025
PREGUNTA," Gracias, Presidenta. Es precisamente eso, la respuesta, muy bien dada.",0.0,10,28,2,2025
PREGUNTA,"Presidenta, sobre esta Agencia de Digitalización y de Tecnología Innovadora que se está implementando en el gobierno, ¿qué balance podría tener sobre estos botones de asistencia que ha habido?",0.0,29,28,2,2025
PREGUNTA,"Ya, por último, Presidenta, porque ya tenía ratito sin preguntar: en Baja California Sur se han filtrado bases de datos de los Programas del Bienestar, y nos ha llegado muchas… Posiblemente estos datos se han filtrado de alguna manera y han hecho llegar por mensajes algunas cuestiones de que les están realizando cobros.",0.0,53,28,2,2025
PREGUNTA,"Y quiero poner con datos precisos, que dice:",0.0,8,28,2,2025
PREGUNTA,"“Le escribe el licenciado Joaquín Herrera Baeza, del Área Jurídica del Banco del Bienestar, Finabien —y se pone a su servicio—. Me pongo en contacto que usted ya tiene una demanda mercantil a su nombre”, el nombre completo de la persona, por eso, es lo raro con el teléfono el mensaje, con una dirección proporcionada, precisas también.",0.0,57,28,2,2025
PREGUNTA,"“Es por esto que en el año 2020 usted recibió del Gobierno de México un Crédito a la Palabra por un monto de 25 mil pesos”. Es decir, todos los datos completos y les están cobrando, y se ponen a disposición.",0.0,41,28,2,2025
PREGUNTA,"Y tengo los mensajes, los correos y todos los datos.",0.0,10,28,2,2025
PREGUNTA,"Y ya, por último, ¿a qué número podrían reportarlo en caso de que tengan…?",0.0,14,28,2,2025
PREGUNTA,"Preguntarle, ayer el presidente Trump se volvió a referir sobre el tema de los aranceles, dijo que se va a imponer el 4 de marzo. Y, bueno, lo pregunto porque muchos han leído la extradición de estas 29 personas hacia Estados Unidos como una posible “moneda de cambio”.",0.0,48,28,2,2025
PREGUNTA,¿Habrá una prórroga en la imposición de estas tarifas? ¿Qué nos puede decir al respecto?,0.0,15,28,2,2025
PREGUNTA," En otros temas, en un momento más habrá un evento para conmemorar los 500 años de la ejecución de Cuauhtémoc, que es, aparte del último tlatoani mexica, es considerado como un ícono de la resistencia indígena ante este proceso de conquista española.",0.0,42,28,2,2025
PREGUNTA,"Preguntarle: ¿México reitera su petición a España que se hizo desde el gobierno pasado de dar, ofrecer un perdón al pueblo mexicano por los crímenes que se cometieron en este proceso de conquista?",0.0,33,28,2,2025
PREGUNTA,"A propósito de Cuauhtémoc y del “Año de la Mujer Indígena”, y recogiendo las diversas expresiones, los diversos testimonios en el medio rural, y también recogiendo la opinión de académicos, hay una propuesta muy concreta que sería un gran legado de esta administración, que es una nueva Ley Agraria, considerando que se han hecho varias modificaciones, considerando que hay varias expresiones y dando seguimiento a los movimientos sociales en el medio rural.",0.0,72,28,2,2025
PREGUNTA,"Por ejemplo, vamos al caso particular de Guerrero: 60 años de un conflicto agrario en el municipio de Malinaltepec, con una comunidad de Alacatlatzala. Que, por cierto, va a pasar ahí cerca el camino que acaban… que dijeron antes, que anunciaron.",0.0,41,28,2,2025
PREGUNTA,"Entonces ese es un ejemplo, 60 años en el Tribunal Agrario, donde también hay que revisar porque también hay irregularidades que se han denunciado permanentemente. Y así como ese caso, hay otros casos en el país, de norte a sur y de este a oeste.",0.0,45,28,2,2025
PREGUNTA,También revisar: ¿cómo anda el Registro Agrario Nacional —las leyes son perfectibles—? ¿Cómo anda la Procuraduría Agraria?,0.0,17,28,2,2025
PREGUNTA,"También debemos recordar que el señor, entonces senador de la República, Ricardo Monreal, el 7 de agosto del 2019 propuso una iniciativa de Ley Agraria, y quedó en la “congeladora”.",0.0,30,28,2,2025
PREGUNTA,"También el entonces senador de la República, el señor Narro, José Narro Céspedes, también propuso un proyecto para expedir la Ley Federal Agraria y derogar la Ley Agraria.",0.0,28,28,2,2025
PREGUNTA,"Bueno, hay que recoger todo esto y es una propuesta, una iniciativa social, académica, etcétera, y hacer una nueva Ley Agraria, esa es una primera propuesta que dejamos a su consideración, señora Presidenta.",0.0,33,28,2,2025
PREGUNTA," También hay otro tema. El 16 de enero de este año nos dio mucho gusto saber el Encuentro Nacional Municipal, donde estuvieron gobernadores y presidentas y presidentes municipales del país.",0.0,30,28,2,2025
PREGUNTA,"Fíjese que es interesante este tema porque habría que promover —si así bien lo tienen a recoger— la revisión del artículo 115 constitucional, que es el Fortalecimiento Municipal.",0.0,28,28,2,2025
PREGUNTA,"Para nadie es secreto en el país, pero los presidentes y presidentas municipales sufren las consecuencias de poco presupuesto, hay baja recaudación del predial, hay problemas de corrupción, algunos roban poquito, también hay cotos de poder, etcétera.",0.0,37,28,2,2025
PREGUNTA,"Hay que revisar para fortalecer, para que se incorporen realmente los programas de desarrollo regional.",0.0,15,28,2,2025
PREGUNTA,"Y también, hay emociones políticas, y a muchos les ha dado en algunos estados por crear nuevos municipios pensando que al crear nuevos municipios se va a desarrollar el estado o el país. Y cuando sabemos que la creación de nuevos municipios —y hay muchos casos— es para generar más burocracia política o burocracia, y es una carga más para el estado, es una carga más para el país.",0.0,69,28,2,2025
PREGUNTA,"También es una propuesta, señora Presidenta, dejamos a consideración de usted.",0.0,11,28,2,2025
PREGUNTA,"También preguntar, más bien dicho, hacer un enunciado muy humilde, pero con un alto sentido de dignidad, el señor Presidente Andrés Manuel López Obrador tuvo a bien aprobar la remodelación de las instalaciones de la Feria de Navidad y Año Nuevo en San Mateo, en Chilpancingo, que este año cumple 200 años esta feria, fue precisamente en 1825 cuando se estableció por Decreto Presidencial por Nicolás Bravo.",0.0,67,28,2,2025
PREGUNTA,"Aprobó el señor Presidente de la República, Andrés Manuel López Obrador, un presupuesto de 269 millones de pesos para remodelar. Este se entregaría a finales del año 2022. Son recursos que ejecutó o tiene que… ejecutó la Sedatu, señora secretaria, señora de Sedatu, y no le entregaron. Hay un avance del 60 por ciento.",0.0,54,28,2,2025
PREGUNTA,"Pedimos, a nombre de toda la población de Chilpancingo, la sede del primer Congreso de Anáhuac, donde se leyeron los Sentimientos de la Nación, con mucha humildad y mucha dignidad del pueblo de Chilpancingo: que se haga una revisión pormenorizada, porque no solamente fueron los 269 millones de pesos, sino que hubo una extensión presupuestal que alcanzó, si no me equivoco, a 320 millones de pesos, y han pasado prácticamente cuatro años y no entregan la obra.",0.0,77,28,2,2025
PREGUNTA,"¿Y saben qué es lo peor? Son 6 hectáreas, la redujeron a 4 hectáreas. Ya no es un recinto ferial, ya es un parque, y en este año…",0.0,28,28,2,2025
PREGUNTA,"Plantearle que una de las solicitudes permanentes en la comunidad cultural es buscar el equilibrio entre los grandes conciertos masivos que, si bien nacieron con el ingeniero Cárdenas para abrir este espacio democrático y que la gente pudiera acceder a estos conciertos que de otra manera no podría, en estos casi 30 años ha ido en detrimento del desarrollo cultural de los grupos artísticos independientes.",0.0,65,28,2,2025
PREGUNTA,"Porque los gobiernos no dudan en gastar de 10 a 18 millones de pesos para un concierto masivo, mientras que para una función de Alas y Raíces, por ejemplo, pagan mil 500 pesos: para una presentación de teatro, de música, 30 mil, 40 mil pesos —si bien la va—, y para lectura de escritores pues cero pesos.",0.0,57,28,2,2025
PREGUNTA,"Entonces, preguntarle si ¿su gobierno, si usted tendría considerado equilibrar esta desigualdad y mejorar las condiciones de contratación de estos grupos culturales independientes?, pues que sigan siendo un sector vulnerado, un sector precario, en la pandemia no fue considerado como un sector sustancial.",0.0,43,28,2,2025
PREGUNTA,"Y esta precariedad en el que se encuentran parece que se va a prolongar. Entonces, preguntarle si ¿podría buscar como estos equilibrios?",0.0,22,28,2,2025
PREGUNTA," Gracias, Presidenta.",0.0,2,28,2,2025
PREGUNTA,"Una de las decisiones —yo creo— icónicas o disruptivas que hizo el Presidente Andrés Manuel López Obrador fue cuando anunció que se iban a acabar los “moches” que se hacían en la Cámara de Diputados. Y, obviamente, se terminaron estos apoyos que se daban a varios sectores, entre ellos al sector cultura.",0.0,52,28,2,2025
PREGUNTA,"Pero decirle que ese esquema de los moches finalmente no fueron definidos por los grupos culturales o los grupos independientes, sino fueron establecidos justamente por los diputados, ¿no? Pero aquí pagaron como justos por pecadores porque había muchos grupos, asociaciones civiles, culturales, que hacían trabajo en territorio, en comunidades y apoyaban a atender a sectores que a los gobiernos no les alcanza el recurso humano, ni les alcanza el tiempo, y ellos coadyuvan.",0.0,73,28,2,2025
PREGUNTA,"Entonces, preguntarle, Presidenta, si ¿usted consideraría…",0.0,6,28,2,2025
PREGUNTA," Pero desde Hacienda, Presidenta, con esquema diferente.",0.0,7,28,2,2025
PREGUNTA,"También, comentarle que en julio fue anunciado por la Secretaría de Bienestar el programa “Juntos pintemos Acapulco”, que era justamente como para recuperar la imagen de Acapulco devastado por “Otis”.",0.0,30,28,2,2025
PREGUNTA,"En agosto se hicieron como las asambleas barriales para determinar las casas, las gamas de colores; y en septiembre se inició este programa con la meta de pintar 300 mil casas; pero, bueno, vino “John” en septiembre y este programa se interrumpió; entonces, preguntarle si ¿usted tiene…?",0.0,47,28,2,2025
PREGUNTA,"Por último, Presidenta: como usted sabe, más de 200 mil viviendas fueron afectados por el huracán “Otis”. Y se les dio este apoyo que dio el Presidente Andrés Manuel y muchas casas se recuperaron; pero volvemos a que después vino “John”, volvió a afectar las viviendas y hay una precariedad de la vivienda en Acapulco, que no está construida como para resistir los huracanes, ¿no?",0.0,65,28,2,2025
PREGUNTA,"Y preguntarle, en este programa que usted está  anunciando de construcción de un millón de viviendas, ¿como cuántas viviendas tendrían considerado como para construir en Acapulco?",0.0,26,28,2,2025
PREGUNTA,"Y también preguntarle si, ¿tienen un diagnóstico? Porque en Acapulco se presenta mucho el fenómeno de segunda vivienda, o sea, hay muchas viviendas abandonadas. Y por una parte están como eso, ¿no?, con viviendas que no se usan, ¿no?, que fueron compradas con gente de la Ciudad de México o de otros estados; y, por otro lado, hay una necesidad de vivienda segura, que no se inunde en Acapulco.",0.0,69,28,2,2025
PREGUNTA,"Entonces, preguntarle…",0.0,2,28,2,2025
PREGUNTA," Buenos días, Presidenta Claudia Sheinbaum. Me presento, soy Eduardo Giusseppe, de la revista Huellas de México.",0.0,16,28,2,2025
PREGUNTA,"Y con base en los datos que nos han participado en las pasadas “mañaneras”, su gobierno busca que la CFE y Pemex tengan un cambio constitucional, institucional y reformas para consolidar su recuperación.",0.0,33,28,2,2025
PREGUNTA,"En este contexto le pregunto, Doctora: ¿qué va a pasar con el Sindicato de Trabajadores Petroleros de la República Mexicana?, que mucho tiene que ver en el desastre que arrastra el país, permitiendo recuerdos de personal de manera arbitraria, inmensa corrupción y nepotismo, además de otros actos de corrupción. ¿Qué opinión le merece Doctora? ¿Qué se puede hacer?",0.0,58,28,2,2025
PREGUNTA, Elegir bien a sus...,0.0,4,28,2,2025
PREGUNTA,"Y en otra instancia, si me permite, Doctora. En días anteriores se publicó un informe llamado “Explotación y opacidad”, donde describen la situación de los caficultores en México. Y la situación la describen como deplorable, porque empresas transnacionales como Nestlé y Starbucks pagan precios muy, pero muy bajos por kilogramo al caficultor mexicano, que ni siquiera les alcanza para los costes de producción.",0.0,63,28,2,2025
PREGUNTA,"Entonces, ¿cómo se les puede proteger a los caficultores de estas situaciones de que sea el pago justo para ellos?, porque también sabemos que en este tipo de situaciones hay “coyotes” y empresas intermediarias que no permiten al caficultor reciba un precio justo, ¿qué se puede hacer?, ¿ahí cómo protegerlos?",0.0,50,28,2,2025
PREGUNTA,"Presidenta, en el Valle del Mezquital, estado de Hidalgo, varios usuarios se quejan del mal sistema de repartición de agua de riego. Una vez más hacen de su conocimiento igual que en su momento se lo hicieron saber al expresidente de México, Andrés Manuel López Obrador.",0.0,46,28,2,2025
PREGUNTA,"Los campesinos de Francisco I. Madero en el estado de Hidalgo, a través de su representante legal, Javier Arteaga Morales, le solicitan a usted tenga la gentileza de brindarles una reunión para que una comisión reducida le expliquen aspectos de la problemática y de la corrupción que invade la Comisión Nacional del Agua, Conagua, en Hidalgo.",0.0,56,28,2,2025
PREGUNTA,"Ya que desde la administración anterior, lo que va de esta, los responsables de transmitirle la información le han dado un reporte que no ha sido el correcto. Ahí fíjese que también le piden la destitución de unos funcionarios.",0.0,39,28,2,2025
PREGUNTA,"Por lo expuesto, Presidenta, le suplican designe a un comisionado especial federal, honesto, que le brinde atención directa y supervise que sus indicaciones se cumplan, y que contribuyan en garantizar que sean escuchados, pero, sobre todo, verifique que el recurso de revisión que interpusieron ante el director nacional de la Conagua sea el resultado de honestidad, prontitud, transparencia.",0.0,58,28,2,2025
PREGUNTA,También le expresan que es importante dejar de suministrar recursos públicos.,0.0,11,28,2,2025
PREGUNTA,"¿Se podrá hacer algo por estos miles de campesinos, Presidenta en Hidalgo?",0.0,12,28,2,2025
PREGUNTA," Gracias, Presidenta.",0.0,2,28,2,2025
PREGUNTA,"Por otro lado, académicos de la Universidad Autónoma de Chapingo le piden la intervención de las Secretarías de Hacienda, y Agricultura, y apelan a su sensibilidad para que se mejoren sus salarios; tiene emplazada a huelga a la universidad ante la falta de respuesta del rector Ángel Garduño.",0.0,48,28,2,2025
PREGUNTA, ¿Perdón?,0.0,1,28,2,2025
PREGUNTA, Chapingo.,0.0,1,28,2,2025
PREGUNTA," Una pregunta más, Presidenta, es con respecto a la clínica 25, esto sobre Calzada Ignacio Zaragoza, en la zona oriente de la Ciudad de México, ¿qué avances tiene y si tiene alguna fecha de…?",0.0,34,28,2,2025
PREGUNTA, —Agosto—.,0.0,1,28,2,2025
