Participante,Texto,Sentimiento,Palabras,Dia,Mes,Anio
PREGUNTA," El acercamiento social es vital para lograr cohesión en la comunidad. Por ello, la Secretaría de Gobernación, en coordinación con otras dependencias de gobierno y organizaciones civiles y religiosas, lleva a cabo acciones para identificar y atender necesidades de la población con el objetivo de fortalecer la atención a las causas y seguir construyendo la paz.",0.0,56,28,1,2025
PREGUNTA," Con esta estrategia, del 1o. de octubre a la fecha, 141 mil 232 elementos del Ejército, la Armada, la Fuerza Aérea y la Guardia Nacional, en coordinación con las autoridades de los tres órdenes de gobierno, han llevado a cabo diversas operaciones de prevención, vigilancia y reconocimiento, aunado a numerosos trabajos de investigación y de campo con los que se obtuvieron los siguientes resultados:",0.0,64,28,1,2025
PREGUNTA,10 mil 148 detenidos y el aseguramiento de 4 mil 981 armas de fuego.,0.0,14,28,1,2025
PREGUNTA,868 mil 905 cartuchos.,0.0,4,28,1,2025
PREGUNTA,452 granadas.,0.0,2,28,1,2025
PREGUNTA,7 mil 385 vehículos.,0.0,4,28,1,2025
PREGUNTA,Mil 197 kilogramos y 738 mil 970 pastillas de fentanilo.,0.0,10,28,1,2025
PREGUNTA,34 mil 388 kilogramos de metanfetamina.,0.0,6,28,1,2025
PREGUNTA,31 mil 978 kilogramos de cocaína.,0.0,6,28,1,2025
PREGUNTA,Y 24 mil 946 kilogramos de marihuana.,0.0,7,28,1,2025
PREGUNTA," Dentro de estos resultados, y mediante continuas operaciones de inteligencia, vigilancia e intercepción terrestre para reducir el trasiego de narcóticos, destaca el aseguramiento de:",0.0,24,28,1,2025
PREGUNTA,"420 kilogramos de metanfetamina en Culiacán, Sinaloa.",0.0,7,28,1,2025
PREGUNTA,"648 kilogramos de cocaína en el municipio El Marqués, Querétaro.",0.0,10,28,1,2025
PREGUNTA,"7 mil 813 kilogramos de metanfetamina en cuatro laboratorios clandestinos en Culiacán, Sinaloa.",0.0,13,28,1,2025
PREGUNTA,"20 mil 875 kilogramos de sustancias químicas en un laboratorio en Tlaxco, Tlaxcala.",0.0,13,28,1,2025
PREGUNTA," Además, en estos últimos 14 días resalta la captura de los siguientes objetivos prioritarios: Juan Carlos “N”, Tomás “N”, Jesús Daniel “N”, Héctor Abel “N”, Carlos “N”, Daniel Eduardo “N”, Milton Bladimir “N” y Raúl Alonso “N”.",0.0,37,28,1,2025
PREGUNTA," Con el propósito de reducir la violencia propiciada por el uso de armas de fuego y sensibilizar a la población sobre el riesgo de tenerlas en casa, la Secretaría de Gobernación, en forma conjunta con la Secretaría de la Defensa Nacional y organismos eclesiásticos, a partir del 10 de enero del 2025 inició el programa “Sí al Desarme, Sí a la Paz”, mediante el cual se canjea armamento y municiones por numerario.",0.0,72,28,1,2025
PREGUNTA,"Cada arma recibida en este proyecto representa, por lo menos, un delito no cometido en nuestro país, habiéndose captado hasta el momento:",0.0,22,28,1,2025
PREGUNTA,501 armas de fuego.,0.0,4,28,1,2025
PREGUNTA,367 cargadores.,0.0,2,28,1,2025
PREGUNTA,25 mil 277 cartuchos,0.0,4,28,1,2025
PREGUNTA,Y 37 granadas.,0.0,3,28,1,2025
PREGUNTA," Gracias a las acciones emprendidas por autoridades federales, estatales y municipales, se han logrado restablecer las actividades cotidianas de la población en diversas partes del territorio, permitiendo una recuperación progresiva de la estabilidad económica y social de los siguientes sitios que presentaban problemáticas: Pantelhó, Chiapas; Nuevo Laredo, Tamaulipas; y Acapulco, Guerrero.",0.0,51,28,1,2025
PREGUNTA," Por otra parte, las acciones realizadas por el Gabinete de Seguridad para reducir la violencia, aunado a las labores que implementó la pasada administración, han permitido obtener una disminución sostenida del 20.38 por ciento en el delito de homicidios dolosos a nivel nacional del 1º de octubre a la fecha.",0.0,50,28,1,2025
PREGUNTA," Un indicador donde se puede observar los resultados favorables de la estrategia es el turismo internacional, el cual registró, de enero a diciembre de 2024, el ingreso de 45 millones 300 mil turistas, con un incremento de 3 millones 400 mil visitantes en comparación con el mismo periodo del 2023, lo que representa un alza del 8.1 por ciento.",0.0,59,28,1,2025
PREGUNTA,"Esto habla de la creciente percepción en el exterior de los niveles de seguridad, que poco a poco, pero con paso firme, está logrando nuestro país.",0.0,26,28,1,2025
PREGUNTA,"Otro indicador más de la seguridad en México son las estadísticas de residentes extranjeros, los cuales indican que, al año 2024, se incrementó el número de personas de diferentes nacionalidades que viven en nuestro país en un 14.1 por ciento; por lo que respecta a los ciudadanos estadounidenses, el incremento fue de 8.2 por ciento.",0.0,55,28,1,2025
PREGUNTA," El trabajo que cada día realizan las dependencias de seguridad del Gobierno de México por garantizar el bienestar de los ciudadanos se refleja en estos resultados, porque cada mexicana y mexicano merece un país más próspero y justo.",0.0,38,28,1,2025
PREGUNTA,"Presidenta, ahorita que hablaban también sobre el tema de seguridad, ¿no sé si hablaron de Querétaro también de un tema de los laboratorios?, ¿no sé si hay datos concretos de Querétaro?, ¿si hubo algunos laboratorios en Querétaro?",0.0,37,28,1,2025
PREGUNTA,"¿Y si se maneja todavía el dato de los policías por estado? Antes se manejaba siempre policías estatales, municipales, por estado para ver si se cumplía con los estándares internacionales. ¿Si ha habido un avance o esa información ya no se maneja?",0.0,42,28,1,2025
PREGUNTA,"No sé si, como es miércoles ese día, vaya, tenga contemplado realizar ahí la conferencia de prensa, “La Conferencia del Pueblo”, ahí en Querétaro, que es miércoles 5 de febrero.",0.0,30,28,1,2025
PREGUNTA,"Ahí me surgió una duda porque se hablaba de un salario integrado para la aportación para la salud de los trabajadores: donde va a haber una mayor aportación porque, si se incluye el “salario integrado”, ahí ese concepto no existe actualmente en los manuales de salarios; normalmente es sueldo base más compensación garantizada.",0.0,53,28,1,2025
PREGUNTA,"Y aquí la duda es que si ¿ese salario o ese salario integrado que tendría ser sueldo base más compensación garantizada, también se va a incluir en lo que es la jubilación de sus mandos?, porque, obviamente, van a dar una aportación mayor. Entonces debería ser como acorde a otra jubilación.",0.0,51,28,1,2025
PREGUNTA,"Normalmente un mando medio se jubila con menos de 10 mil pesos como jubilación, incluso se llegan hasta con menos salario que sus subordinados. Por eso, se ha hablado históricamente a lo mejor de lo que este el “elefante reumático”.",0.0,40,28,1,2025
PREGUNTA,"Normalmente en las Secretarías de Estado hay mucho personal con más de 30 años de trabajo. No se quieren jubilar porque, obviamente, si están ganando a lo mejor arriba de 20 mil, 50 mil pesos, pues se van a terminar jubilando con menos de 10 mil pesos. Entonces, es complicado a veces para esa gente llegar a jubilarse.",0.0,58,28,1,2025
PREGUNTA,"Entonces, ¿no sé se podría aclarar ese punto de que si se va a incluir o no?, ¿o cómo está contemplado la ley en ese punto?",0.0,26,28,1,2025
PREGUNTA,"Presidenta, también, y es un tema nada más de que piden su apoyo para que la Fiscalía del estado de Querétaro no congele una denuncia por negligencia médica de un hospital particular denominado Centro Médico Jurica, ya que en ese Centro Médico Jurica operaron a un niño por una operación menor, y terminaron dándole una anestesia general, y el niño quedó en estado vegetal. Y el niño sigue sufriendo mucho; tiene como 8 o 9 años el niño.",0.0,78,28,1,2025
PREGUNTA,"Entonces, nada más piden su apoyo para que (inaudible) descongele o no tengan ahí ese caso en Querétaro la Fiscalía sin hacer nada, ¿no?, porque, la verdad, es un caso muy, muy triste de un niño que era normal, uno lo veía jugando futbol normal, y de repente por una operación menor terminó así.",0.0,54,28,1,2025
PREGUNTA,"Aquí tengo todos los datos para… Ya, incluso, ya presentó en Atención Ciudadana su queja y pedir el apoyo de su parte en lo que pudiera corresponder.",0.0,27,28,1,2025
PREGUNTA,"Preguntarle en el tema de seguridad sobre el gobernador Rubén Rocha. Ayer dio algunas declaraciones, las cito: “El pueblo quita y no alguien que grita”; y sobre los enemigos: “Los enemigos son los criminales, no el gobierno”.",0.0,37,28,1,2025
PREGUNTA,"¿Saber, qué opinión tiene al respecto?, y saber si ¿la contención de los homicidios en Sinaloa, ya tienen una contención, ya ha disminuido este delito?",0.0,25,28,1,2025
PREGUNTA,Saber si ¿se van a reforzar las oficinas de COMAR? Saber si ¿de alguna manera podrían ustedes agilizar estas solicitudes de asilo? ¿O cómo sería esta atención a los migrantes?,0.0,30,28,1,2025
PREGUNTA,"Saber si ¿tiene conocimiento de esto?, ¿por qué se volvería a realizar? Ya tiene varios años que no se publica esta encuesta.",0.0,22,28,1,2025
PREGUNTA,Gracias.,0.0,1,28,1,2025
PREGUNTA,"Mi primera pregunta es para el secretario de Seguridad. Sobre este centro de monitoreo que se identificó en Culiacán, Sinaloa, si, ¿nos puede informar a qué célula criminal respondía?, ¿las cámaras fueron instaladas por parte de estos mismos integrantes de la célula?, ¿y desde cuándo operaba, por favor?",0.0,48,28,1,2025
PREGUNTA,"En otro tema, Presidenta, ayer se daba a conocer la renuncia de los integrantes del Comité de Evaluación del Poder Judicial. Conocer su opinión al respecto, luego de que el Tribunal Electoral anunció que el Senado podía continuar con la selección de los aspirantes.",0.0,44,28,1,2025
PREGUNTA,"Por último, ayer se registraba una protesta por parte de militantes del PAN contra la reforma al Infonavit. Precisamente, ayer daban a conocer esta red de corrupción de juicios masivos que se llevó a cabo dentro del Instituto y en colusión con jueces y despachos jurídicos.",0.0,46,28,1,2025
PREGUNTA,"Y, bueno, en esta protesta también participaba Jorge Romero, a quien se le señala de estar implicado en el cártel inmobiliario. Y bueno, ellos argumentaban que con esta reforma se afectaría a los trabajadores.",0.0,34,28,1,2025
PREGUNTA,¿Cuál es su opinión respecto a estas protestas?,0.0,8,28,1,2025
PREGUNTA,"Presidenta, Ricardo Monreal dijo el domingo en Yucatán que, de ser necesario, reformaría la Constitución mexicana para que Estados Unidos no ingrese a nuestro país.",0.0,25,28,1,2025
PREGUNTA,¿Qué piensa de eso?,0.0,4,28,1,2025
PREGUNTA,"Presidenta, por último, no sé si le han informado que la Garita del Chaparral, en el cruce hacia Estados Unidos del lado de territorio mexicano, hay más de 20 filas, pero únicamente están abiertas seis, esto dificulta el cruce de los mexicanos que están en Estados Unidos de 30 minutos a dos horas.",0.0,53,28,1,2025
PREGUNTA,"En el gobierno del Presidente, del expresidente AMLO, se abrió, pero nuevamente se cerraron.",0.0,14,28,1,2025
PREGUNTA,"Preguntarle sobre un caso de una defensora amuzga del Estado de México, es Kenia Hernández, ella lleva encarcelada desde 2020, ya son cuatro años. Se le acusa de nueve cargos, los cargos los denunció la Capufe.",0.0,36,28,1,2025
PREGUNTA,"Y en su visita, su hijo le entregó una carta para pedirle ayuda, para llegar a algún acuerdo con la Capufe, la Fiscalía, para ver si se podía llegar a un acuerdo.",0.0,32,28,1,2025
PREGUNTA,"Y en un segundo tema, consultarle una duda respecto a la iniciativa sobre el maíz transgénico: comparando la versión que envió el expresidente Andrés Manuel López Obrador el 5 de febrero pasado y la versión final, no se específica en esta versión la prohibición del maíz transgénico para consumo humano.",0.0,50,28,1,2025
PREGUNTA,Y quería saber: ¿a qué responde que no se mencione esta prohibición como tal en la iniciativa y si más adelante podría incorporarse y qué implicaciones tendría?,0.0,27,28,1,2025
PREGUNTA," Entonces, ¿sí podría…?",0.0,3,28,1,2025
PREGUNTA," Ah, ok, muy bien. Muchas gracias.",0.0,6,28,1,2025
PREGUNTA,"Mark Esper, el último secretario de Defensa del presidente Trump, previno al presidente, quien amenazó con lanzar proyectiles Patriot contra los laboratorios de narcotraficantes mexicanos.",0.0,25,28,1,2025
PREGUNTA,"Basado en que su secretario de Seguridad tiene una nueva estrategia de seguridad, a través de la cual recaba la información de inteligencia naval y de inteligencia militar.",0.0,28,28,1,2025
PREGUNTA,"¿Cree que el secretario de Seguridad, la secretaria de Gobernación, el Almirante secretario y el General secretario pudieran evitar ese escenario que no descartó el presidente Trump en su primer cuatrienio y es una amenaza que está palpable? Por un lado.",0.0,41,28,1,2025
PREGUNTA,"Y al fiscal general de la República, preguntarle si ¿él ya investiga las acusaciones que el aludido Francisco Labastida Ochoa expresó en contra de Rocha, a quien acusó en medios —señor fiscal— nacionales de estar vinculado con el crimen organizado y de esa forma haber ganado la gubernatura del estado de Sinaloa?",0.0,52,28,1,2025
PREGUNTA,"Como primer planteamiento, Presidenta.",0.0,4,28,1,2025
PREGUNTA,"Pídale a la secretaria de Gobernación que interceda con los coordinadores parlamentarios para ejecutar la diplomacia interparlamentaria, que se traigan a los senadores republicanos o demócratas y por esa vía, apoyar a la titular del Ejecutivo Federal para encontrar un acuerdo migratorio como el de 1986 en el Acta de la Inmigración de Reagan, que se llevó a cabo, Presidenta, finalmente a través del desarrollo de la diplomacia interparlamentaria.",0.0,69,28,1,2025
PREGUNTA,"La primera pregunta, para la secretaria de Gobernación, sobre lo que acaba de presentar, los 10 Centros de Atención, si ¿nos pueden precisar cuál es la capacidad de los Centros de Atención, es decir, a cuántas personas se pueden recibir en estos centros, cuál es la proyección?",0.0,47,28,1,2025
PREGUNTA,"Y también, en materia financiera, ¿cuál es lo destinado, si tienen un monto global que está abarcando a todo este plan?",0.0,21,28,1,2025
PREGUNTA,Por favor.,0.0,2,28,1,2025
PREGUNTA,"La segunda pregunta, también sobre tema de migración: ayer medios y propias autoridades estadounidenses reportaban un presunto, bueno, ataque armado por parte del crimen organizado del lado de México hacia la Patrulla Fronteriza.",0.0,33,28,1,2025
PREGUNTA,"Saber si, ¿tienen información al respecto, si hay alguna investigación, por favor?",0.0,12,28,1,2025
PREGUNTA,"Y, bueno, tercera pregunta, hoy publicamos en La Razón que continúan las extorsiones por parte de criminales hacia personas migrantes, tanto mexicanas como de otros países, que les aseguran todavía conseguirles citas en el CBP One, que les aseguran cruzar. Y también, del lado de Estados Unidos supuestas organizaciones que les ofrecen ayudas, descuentos en servicios para asistirlos legalmente en su estancia en Estados Unidos.",0.0,65,28,1,2025
PREGUNTA,"Entonces, preguntarle, primero, si ¿tienen denuncias o reportes ya, sobre estas extorsiones que persisten, a pesar de que ya Estados Unidos cerró y que siguen engañando los criminales a los migrantes? Por favor.",0.0,33,28,1,2025
PREGUNTA,"Entonces, ya se le está pidiendo automáticamente al Senado meter los nombres a la tómbola y elegirlos, pero ya no se estaría aplicando el filtro para ver si ¿sí son aptos para el cargo y todos estos demás requisitos que pedía la convocatoria?",0.0,43,28,1,2025
PREGUNTA,"Y bueno, la vez pasada, que se identificó a finales del año pasado, Estados Unidos frenó exportaciones del ganado mexicano.",0.0,20,28,1,2025
PREGUNTA,"Nada más saber si, ¿se está presentando una situación similar? ¿cómo se está atendiendo? ¿cuál es el estatus de esta situación?",0.0,21,28,1,2025
PREGUNTA,"Tomando en cuenta lo que ha hablado de migración y tomando el tema de migración, todo lo que está haciendo en la frontera de México con Estados Unidos, fíjese que tuve la oportunidad de platicar con algunos migrantes y ver toda la situación en los cruces internacionales donde hay deportaciones.",0.0,50,28,1,2025
PREGUNTA,"Me encontré con que era una puerta giratoria prácticamente el CBP One, donde recibían a los migrantes, los fichaban, les tomaban fotografías y los iban a deportar por el lado de Santa Teresa, un lugar —no México; Santa Teresa— donde no hay nada, absolutamente, no es nada, nada más está la garita.",0.0,52,28,1,2025
PREGUNTA,"Y en ese sentido, hay migrantes tanto mexicanos como extranjeros, de diferentes nacionalidades que le agradecen el apoyo que ha estado dando por medio de Gobernación, por medio de autoridades también militares que los han estado apoyando.",0.0,37,28,1,2025
PREGUNTA,"Algunos de ellos buscan quedarse dentro de nuestro país, algunos otros me han externado —y que le pasara a usted la información— de que buscan ser regresados a sus países de origen.",0.0,32,28,1,2025
PREGUNTA,"Pero ellos se han dado cuenta de que hay un tema muy importante en México que es el crecimiento de nuestro país, el Plan México; han estado también enterados acerca de la construcción de trenes; les interesa trabajar alrededor… Nos hemos dado cuenta que hay una inversión muy importante por medio del Estado mexicano, y que se van a generar plazas, de más de 50 mil plazas.",0.0,67,28,1,2025
PREGUNTA,"Entonces, buscan ellos ser contemplados dentro de lo que es esta plantilla, vamos a decirlo ahí, porque hay muchos que tienen experiencia en diferentes trabajos; buscan ellos que se les tome en cuenta.",0.0,33,28,1,2025
PREGUNTA,"Y digo, algunos de ellos me decían: “No queremos trabajar en zonas —fíjense— donde haya mucho frío, sino en zonas cálidas”, porque no están acostumbrados a esto.",0.0,27,28,1,2025
PREGUNTA,Reiterar que le agradecen por parte de su gobierno y su persona el apoyo a los migrantes y que ya se dieron cuenta que en Estados Unidos no hay mucho que esperar.,0.0,32,28,1,2025
PREGUNTA,"En ese sentido, Presidenta, en el Plan México, este proyecto, que va a cruzar prácticamente por todo un lado del país hasta el norte de nuestro país, y este Plan tan ambicioso —que, por cierto, las Fuerzas Armadas, los ingenieros de las Fuerzas Armadas están siendo reconocidos a nivel mundial y están replicando estas obras en otros países—, ¿si hay contemplado dentro de este Plan también migrantes?, ¿si se les va a otorgar algún permiso especial a migrantes centroamericanos para entrar a trabajar a estas obras que ellos también tienen en mente?",0.0,92,28,1,2025
PREGUNTA,"Y resaltar, precisamente, todas estas obras que con el Plan México para mí sería un bombazo internacional. Y creo que su proyecto de que México, de la doceava posición a la 10, sería tal vez más, avanzar, si hubiera una mano de obra rápida, calificada, como se ha hecho en otras ocasiones.",0.0,52,28,1,2025
PREGUNTA,"Y hay un tema. Aparte de migrantes, quisiera anexar ahí una doble pregunta: usted invitó a los empresarios a invertir en México, a hacer un fortalecimiento económico al interior de nuestro país para crecer nuestra economía. Y, obviamente, el desarrollo sería o la base sería —de lo que yo veo— llevar a nuestro país a una economía más arriba, de la 12 al número 10.",0.0,65,28,1,2025
PREGUNTA,"Pero quería preguntarle también —aparte del tema de los migrantes, si van a ser contemplados—que, si ¿tiene contemplado dónde se va a reproducir?, ¿dónde se van a hacer las vías, ya que en nuestro país no hay una fábrica de vías?, ¿si hay empresarios que van a entrar a este giro?, ¿si lo tienen contemplado?, ¿cuál es el plan?",0.0,59,28,1,2025
PREGUNTA,"Estos temas en una primera pregunta, si me permite.",0.0,9,28,1,2025
PREGUNTA,"Y en segundo tema, Presidenta, si me permite: ayer se filtró una información por un medio de comunicación de la frontera, en donde se apunta de una colusión, de un contubernio, entre autoridades migratorias y uno de los cárteles de la zona norte del país, donde hay un video, y circula en redes, donde se deja por medio de una puerta en la franja fronteriza pasar a los migrantes en la madrugada.",0.0,72,28,1,2025
PREGUNTA,Y a ver ¿si tuvieran información de esto? Y para cerrar con este tema de migrantes.,0.0,16,28,1,2025
PREGUNTA,"Y también, hace unos minutos, antes de iniciar “La Mañanera”, Donald Trump, el día de ayer —como poniendo en contexto— daba a conocer que se le iba a cambiar el nombre, desde hace días, pero lanza un decreto, el tema del Golfo de México.",0.0,44,28,1,2025
PREGUNTA,"Y hoy tiene resultados: Google acaba de avisar que sí se le va a cambiar el nombre en los mapas generales a una parte de lo que es San Antonio hasta Florida, una línea divisoria, en donde se le va a llamar “Golfo de América”. Y va a aparecer ya en los mapas a nivel mundial, y depende del área donde se vea, se va a ver Golfo de México, todavía como se conoce hoy, y después en el territorio norteamericano se va a conocer como “Golfo de América”.",0.0,89,28,1,2025
PREGUNTA,"En ese sentido, Presidenta, en el sexenio de Zedillo, le comentaba yo en la última intervención que tuve que hay una parte ahí donde hay una zona donde hay yacimientos petroleros, se le conoce como el “Hoyo de la Dona”, y la Isla Bermeja, que en el sexenio de Zedillo quisieron desaparecerla, me parece que hay…",0.0,56,28,1,2025
PREGUNTA,"Creo que no es tan inocente nada más cambiarle el nombre al Golfo de México, sino tiene que ver con la explotación de petróleo.",0.0,24,28,1,2025
PREGUNTA,"¿Su opinión acerca de esto, por último?",0.0,7,28,1,2025
