Participante,Texto,Sentimiento,Palabras,Dia,Mes,Anio
PREGUNTA, El Programa de Conservación de Carreteras “Bachetón” sigue avanzando y ya está en todo el país.,0.0,16,26,2,2025
PREGUNTA,"La Secretaría de Infraestructura, Comunicaciones y Transportes continúa con la conservación en toda la red carretera federal libre de peaje con el Programa de Conservación de Carreteras: “Bachetón”.",0.0,28,26,2,2025
PREGUNTA,"Hemos avanzado con 212 mil baches atendidos, equivalente a 152 mil 300 toneladas de mezcla asfáltica y 946 mil 200 metros cuadrados, con mil 939 equipos de trabajo, 277 cuadrillas operando y mil 662 trabajadores.",0.0,35,26,2,2025
PREGUNTA,Con un avance de 31 mil 600 kilómetros de la red carretera federal libre de peaje.,0.0,16,26,2,2025
PREGUNTA,"En la conservación periódica avanzamos con 2 millones 55 mil 900 metros cuadrados atendidos, equivalente a 230 mil 500 toneladas de mezcla asfáltica, con 375 equipos de trabajo y 688 trabajadores.",0.0,31,26,2,2025
PREGUNTA,Con estos trabajos beneficiamos a los más de 100 millones de mexicanas y mexicanos.,0.0,14,26,2,2025
PREGUNTA,"En el camino al Segundo Piso de la Cuarta Transformación construimos, mantenemos y mejoramos las vías que comunican a México.",0.0,20,26,2,2025
PREGUNTA,"Secretaría de Infraestructura, Comunicaciones y Transportes.",0.0,6,26,2,2025
PREGUNTA,Gobierno de México.,0.0,3,26,2,2025
PREGUNTA,(CONCLUYE VIDEO),0.0,2,26,2,2025
PREGUNTA,"Presidenta, la semana pasada comentó que hará una visita próxima a Baja California para trabajar en conjunto con el gobierno del estado para detener a los generadores de violencia que más han dañado a los habitantes.",0.0,36,26,2,2025
PREGUNTA,¿Qué avances nos puede dar de eso?,0.0,7,26,2,2025
PREGUNTA,El día de ayer se aprobó la reforma contra el nepotismo…,0.0,11,26,2,2025
PREGUNTA,"Por último, con la estrategia “Vive saludable, vive feliz”, ¿cómo se va a trabajar con las cooperativas escolares para retirar la comida chatarra?",0.0,23,26,2,2025
PREGUNTA,"Y permítanme continuar insistiendo un poco con la aprobación de la reforma contra el nepotismo, Doctora, pues pareciera que todo está bien, pero el cambio que se aprobó a la reforma, a la esencia que usted la mandó se dio, según el presidente de la Mesa Directiva del Senado, Gerardo Fernández Noroña, cito sus palabras, palabras más, palabras menos: “fue porque el gobernador de San Luis Potosí, Ricardo Gallardo, desea que su esposa participe en el proceso por la sucesión al gobierno en 2027”.",0.0,84,26,2,2025
PREGUNTA,"Presidenta, cambiaron su propuesta de reforma para que un gobernador deje a su esposa en el cargo, Presidenta. Pospusieron erradicar el nepotismo hasta 2030 para consumar un acto más de nepotismo más, como diciendo “la última y nos vamos”.",0.0,39,26,2,2025
PREGUNTA,"Sobre esto, Presidenta, ¿le parece bien la forma en la que discutieron ayer los senadores y aprobaron esta propuesta que usted les envió?, ¿está conforme con el proceso?, ¿enviará alguna otra para recomponerla?, ¿y qué opinión le merece la forma de actuar de los senadores de Morena?",0.0,47,26,2,2025
PREGUNTA,"Y cambiando de tema, ayer se dio a conocer a través de un medio de comunicación que un grupo de empresarios hispanos encabezados por una tapatía muy cercana o vinculada con el Partido Republicano impulsa una coalición denominada “Bienvenidos, empresarios”, la cual busca afiliar a hombres de negocios de Monterrey, Nuevo León, a quienes les ofrecen acceso directo al presidente de Estados Unidos, Donald Trump, a cambio de un donativo de 250 mil dólares.",0.0,74,26,2,2025
PREGUNTA,"Y eso se suma también al anuncio que hizo el mandatario norteamericano sobre la denominada Visa Dorada, que es un nuevo tipo de permiso de residencia legal con la que se podrá obtener a cambio de 5 millones de dólares con los beneficios de acceder a la norteamericana con el tiempo.",0.0,51,26,2,2025
PREGUNTA,"Doctora, ¿alguna opinión al respecto de estos anuncios?",0.0,8,26,2,2025
PREGUNTA,"Hoy el diario Reforma publica una nota en la que supuestos empresarios, dueños de la concesión de Aguakan, acusan que han sido presionados por el gobierno de Quintana Roo, para quitarles la concesión, cuando en realidad han defraudado al pueblo de Quintana Roo con el servicio de agua potable, pues se sabe que el agua no está en las mejores condiciones, está sucia, contaminada, además de que sus altos cobros por el servicio y que privan muchas veces del servicio a quienes no pueden pagarla a veces.",0.0,87,26,2,2025
PREGUNTA,"El pueblo votó, Presidenta, hace algunos meses para que se les quite la concesión, hay órdenes de aprehensión, incluso, en contra de dueños, los Ballesteros. Y no debemos olvidar que la empresa dueña de Aguakan, de nombre GBM, dio mil millones de pesos al gobierno del hoy preso exgobernador priista Roberto Borge para ampliar 30 años la misma.",0.0,58,26,2,2025
PREGUNTA,"Por último, se sabe que un exconsejero jurídico de la Presidencia es uno de sus principales asesores de estos empresarios.",0.0,20,26,2,2025
PREGUNTA,"Preguntarle, Presidenta: ¿cuál es la opinión sobre este fraude al pueblo de Quintana Roo, que ha dañado tanto a la población y que limita a veces —como le repito— el acceso a un derecho humano tan básico, como es el derecho al agua?",0.0,43,26,2,2025
PREGUNTA,"Justo con el tema de la discusión de la Ley contra el Nepotismo, ¿no es un desafío a la voluntad popular que usted recogió durante la campaña, Presidenta?",0.0,28,26,2,2025
PREGUNTA,"¿Confiaría también en los otros partidos, como en el caso, por ejemplo, de San Luis Potosí que es el Verde? Y que, aunque ya dijo la esposa del gobernador, que no aspira a relevarlo en el cargo, ¿confía que el Verde también vaya por esta línea?",0.0,46,26,2,2025
PREGUNTA, Y también preguntarle…,0.0,3,26,2,2025
PREGUNTA,"Y ya por último: lleva ya casi 5 meses en el cargo y normalmente se da un desgaste natural, pero, incluso, hay una encuesta de El Heraldo que saca el que le dan un 78 por ciento de aprobación, parece contrario a que…",0.0,43,26,2,2025
PREGUNTA,"En materia de seguridad, bueno ya comentaba que, en estas negociaciones por el tema del narcotráfico y la drogadicción, que probablemente haya otra llamada telefónica, pero ¿no se ha considerado un encuentro presencial allá, bueno, con el presidente Trump para darle seguimiento a este tema de la reducción de la drogadicción? En donde ya anunció la campaña de 200 millones de dólares, pero también no solo una campaña publicitaria, sino también una campaña preventiva, integral y, bueno, también sobre la reducción de la violencia en México que es el tema para evitar que los cárteles sigan mandando droga y eso también reduciría la violencia en México.",0.0,106,26,2,2025
PREGUNTA,¿Qué tan factible podría ser? ¿Y en qué tiempo un encuentro presencial?,0.0,12,26,2,2025
PREGUNTA,"Hubo un cambio de director de esta empresa Agua de Puebla. Se privatizó en el sexenio de Rafael Moreno Valle. Están tratando de evitar que haya más quejas, porque sí había muchas quejas.",0.0,33,26,2,2025
PREGUNTA,"Todavía no se inicia el litigio, pero ¿qué llamado haría para, no sé si en una primer instancia, sí cumpla la empresa con sus obligaciones de ofrecer agua? ¿O cuál sería su postura al respecto de esta empresa Agua de Puebla, en la capital poblana?",0.0,45,26,2,2025
PREGUNTA,"Sobre el tema, en un reporte de este año de la Secretaría de Infraestructura, Comunicaciones y Transportes se informó que los estados con las peores carreteras son Oaxaca, Guerrero y el Estado de México, el centro-sur básicamente, debido a que en promedio más del 50 por ciento de su infraestructura carretera se encuentra en malas condiciones.",0.0,56,26,2,2025
PREGUNTA,"¿Va a haber alguna, ―ahora aprovechando que está presentando toda esta información― va a haber atención especial a estos estados, alguna coordinación con los gobernadores de estos estados, algunos programas? ¿Podría informarnos?",0.0,32,26,2,2025
PREGUNTA,"Volviendo a la política, Presidenta, desde hace semanas al Senado de la República llegó la propuesta de una coordinación nacional para el combate al fentanilo y drogas sintéticas; una iniciativa del priista “Alito” Moreno, siendo él mismo el primero en la lista para el cargo, con el fin de, y cito, “coordinar esfuerzos entre los tres órdenes de gobierno, colaborar con organismos internacionales, supervisar a las fuerzas de seguridad”. Básicamente “Alito” quiere gobernar México sin que lo voten, ¿no?",0.0,79,26,2,2025
PREGUNTA,"¿Tomaría en serio esta propuesta de un zar antidrogas para México, Presidenta?",0.0,12,26,2,2025
PREGUNTA,"Entre otras voces, el dirigente nacional del PAN, Jorge Romero, concluyó a partir de estas imágenes que debería aplicarse cadena perpetua a funcionarios coludidos con el narco; nunca en su alocución menciona a García Luna.",0.0,35,26,2,2025
PREGUNTA,"Y también asegura que la 4T reza para que “el Mayo” no hable en Estados Unidos de sus vínculos, en particular de una supuesta relación entre el cártel de Sinaloa y el expresidente Andrés Manuel López Obrador.",0.0,37,26,2,2025
PREGUNTA,"¿Qué responde a estos ataques de la oposición, Presidenta?",0.0,9,26,2,2025
PREGUNTA,Preguntarle: ¿cuál es el objetivo del Programa de Infraestructura Carretera de 2025 a 2030 y cuáles serían los puntos que más destacaría?,0.0,22,26,2,2025
PREGUNTA,"En otro tema. A un mes de que Donald Trump tomó posesión ¿cuál sería el balance que usted realiza, dado que antes de que entrara, incluso en campaña se decía que probablemente iba a haber una crisis bilateral?, incluso hay datos que arrojan totalmente lo contrario; por ejemplo, durante 2024 México registró una Inversión Extranjera Directa por 33 mil 832 millones de dólares, el mayor monto desde 1999.",0.0,68,26,2,2025
PREGUNTA,¿Cuál sería el balance que usted haría a este mes?,0.0,10,26,2,2025
PREGUNTA,"Preguntarle si ¿desde la Secretaría de las Mujeres hay, va a haber algún impulso para fomentar estas iniciativas en otros estados?",0.0,21,26,2,2025
