Participante,Texto,Sentimiento,Palabras,Dia,Mes,Anio
PREGUNTA, México News World y del periódico digital Hidalgo News.,0.0,9,28,11,2024
PREGUNTA,"El tema, sobre los trenes. ¿Cuál será el desarrollo económico que tendrá el país? Luego de que, pues Ernesto Zedillo los privatizó, los vendió. Y, ¿la generación de empleos directos e indirectos, sobre la construcción y posteriormente, a la misma?",0.0,40,28,11,2024
PREGUNTA,"¿Cómo adicionan este trabajo? ¿Y cuál es el mejoramiento de este proyecto? Que finalmente sí resulta tan importante que hay, incluso, boletos que están cancelados, bueno que están llenos ya, digamos, para que puedan cruzar toda esta área del sureste mexicano.",0.0,41,28,11,2024
PREGUNTA, Deme una.,0.0,2,28,11,2024
PREGUNTA,"En ese sentido, en Hidalgo va a haber en breve una elección municipal en Cuautepec. Morena, en el pasado mes de junio presentó 84 candidatas a las Alcaldías; perdieron 33, 32, no sé exactamente. Hoy va a repetirse una elección. ¿Qué opinión le merece que haya una elección extraordinaria en un municipio de un estado que conforma 84 Alcaldías, usted, que ha sido una mujer demócrata?",0.0,66,28,11,2024
PREGUNTA,"Usted en su toma de protesta dijo que “cero corrupción en su administración”, hace dos semanas volvió a reiterar el tema de cero corrupción.",0.0,24,28,11,2024
PREGUNTA,"Sin embargo, Presidenta, en el IMSS hay empresas, ahora que están con las licitaciones, pues tratan o están buscando la manera de reiterar o renovar sus contratos que tiene con el IMSS. Le voy a poner un ejemplo: la empresa Ensayos y Tamizajes de México S.A de C.V. que se ve involucrado, digamos, en corrupción, porque es una empresa que ya tenía un contrato con el IMSS.",0.0,67,28,11,2024
PREGUNTA,"La empresa señalada, esta empresa ha sido señalada por la Cofece como parte del cártel G6, cuyo dueño es José María Gutiérrez, personaje conocido en el ámbito por monopolizar el tema de tamizaje neonatal.",0.0,34,28,11,2024
PREGUNTA,"Ahora, esta empresa está buscando la manera de quedarse con contratos —los que son multimillonarios porque sabemos que esos contratos pues son multimillonarios, porque son por sexenios o por año, no sé exactamente— están buscando volver a quedarse con un contrato con insumos que vienen de China.",0.0,47,28,11,2024
PREGUNTA,"Entonces, ahí poner el ojo, Presidenta, sobre todo, que pues ahí en la oficina de Ana Laura Montes de Oca, pues está ahí buscando este personaje de la empresa para quedarse otra vez con ese, digamos, contrato bajo la cobertura del Tratado de Libre Comercio que, obviamente, no se permite tener productos de insumo de otros países cuando no se tiene un contrato junto con la empresa.",0.0,67,28,11,2024
PREGUNTA,"Entonces, preguntarle…",0.0,2,28,11,2024
PREGUNTA, Pulso Saludable.,0.0,2,28,11,2024
PREGUNTA,"Presidenta, preguntarle: ¿cuál es la durabilidad de los baches? De bachear, de dejar el terreno como debe de estar, porque de pronto comienza la época de nuevo de lluvias y se vuelve a hacer el bache. Entonces, ¿tiene una durabilidad o es parte del proceso natural de la construcción y no pensar que lo hicieron mal? Esa sería mi primera pregunta del tema.",0.0,63,28,11,2024
PREGUNTA,Gracias.,0.0,1,28,11,2024
PREGUNTA," Gracias. Y del mismo tema, pero hablando de los ferrocarriles, quisiera saber si ¿ya hay alguna empresa interesada en el tema de los ferrocarriles de carga? Parecía que había algún interés de Grupo México, no sé si se ha concretado algo.",0.0,41,28,11,2024
PREGUNTA,"Entonces, en ese sentido yo quisiera preguntarle si, ¿ha pensado en la posibilidad de platicar con sus homólogos de la región sur, de América Central, como en algún momento se hizo en la administración del Presidente Andrés Manuel López Obrador? Para concretar alguna especie de trabajos a seguir y que los mandatarios de estas naciones también atiendan las causas de su gente, porque lo está haciendo de alguna manera exitosa; también México está viendo por otras ciudadanías, pero se trata, entiendo, de trabajar en algo en conjunto.",0.0,87,28,11,2024
PREGUNTA,"¿Qué habría al respecto? Y también preguntarle si, ¿en esta llamada que tuvo con el presidente electo, Donald Trump, platicaron acerca de este tema de los aranceles o ya es algo que debemos de comenzar a olvidar?",0.0,37,28,11,2024
PREGUNTA,"Tengo entendido que México es una de las ciudades en donde más milímetros cúbicos de agua de lluvia caen y literalmente se desperdician. No sé si han pensado en un plan, en una estrategia en edificios públicos, no sé.",0.0,39,28,11,2024
PREGUNTA,"Y en estos nuevos departamentos que se van a construir, ¿estarían pensando en hacerlos, como le llaman, de esta manera, “inteligentes”, con paneles solares o con captadores de agua pluvial, o ponerlos en los edificios? Entiendo que no en todas las construcciones es posible, pero no sé si en algunos edificios públicos se pudiera hacer.",0.0,55,28,11,2024
PREGUNTA,Gracias.,0.0,1,28,11,2024
PREGUNTA," Buenos días, presidenta. Yusbel Carolina, de Código Libre.",0.0,8,28,11,2024
PREGUNTA,"Presidenta, en este tema de la caravana que no está llegando a la frontera, mi pregunta es, ¿estos migrantes dónde están?",0.0,21,28,11,2024
PREGUNTA,"Usted ayer comentaba que muchos están en el AIFA, donde se les están dando zonas de atención integral, pero a los demás, ¿a dónde los están trasladando?",0.0,27,28,11,2024
PREGUNTA,"Muchos de ellos dicen que llegan a Acapulco, a Michoacán, lugares donde el Instituto Nacional de Migración les están ofreciendo que los van a ayudar con los papeles, con trámites, pero por lo menos en Acapulco no se da, o sea, no hay motivo. Y se sienten que son engañados por parte del Instituto, no digo que todos, ¿dónde se encuentran, entonces, parte de estos migrantes de la caravana que no están llegando?",0.0,73,28,11,2024
PREGUNTA," Y se revisaría. Gracias. En otro tema, Presidenta, en semanas atrás se dio a conocer que en la anterior administración indicó a la Comisión de Derechos Humanos indemnizar con 42 millones de pesos al periodista José Gutiérrez Vivó.",0.0,38,28,11,2024
PREGUNTA,"¿Sabe qué concepto fue? ¿Algún pendiente de indemnización con él y bajo qué concepto? ¿Cree usted que sus trabajadores también llevarían a esto, en el Gobierno Federal? ¿Cuál fue el concepto de estos 42 millones?",0.0,35,28,11,2024
PREGUNTA, Bloomberg Línea.,0.0,2,28,11,2024
PREGUNTA,"Retomando lo que mencionó sobre la llamada con el presidente electo Donald Trump, ¿sus equipos acordaron no tocar el tema de aranceles?, ¿o por qué no se tocó el tema?",0.0,30,28,11,2024
PREGUNTA,"Y específicamente le quiero preguntar sobre esta planta BYD, que ellos están buscando instalarse aquí en México. ¿Se va a permitir, digamos, que se instale aquí en el país, en medio de estos cuestionamientos precisamente del presidente electo Trump?",0.0,39,28,11,2024
PREGUNTA, Revolución 3.0.,0.0,2,28,11,2024
PREGUNTA,"Tal parece que lo comercial pasa por la seguridad, y la semana pasada el exasesor empresarial del Presidente López Obrador, Poncho Romo, salió de donde estaba y dio una conferencia para recordarle unos consejos que le dieron algunos funcionarios trumpistas, Robert Lighthizer, David Malpass, Wilbur Ross, en una reunión que tuvo en la Casa Blanca y que se la transmitió a usted.",0.0,62,28,11,2024
PREGUNTA,"Entre esos varios consejos dijo: “Don’t play with China” Y según ellos, para ellos el Tratado Comercial no solo es un asunto de negocios, sino de seguridad nacional.",0.0,28,28,11,2024
PREGUNTA,"Le digo esto por el mensaje que mandó usted ayer, de “tender puentes en lugar de levantar muros o cerrar fronteras”. Mientras aparecen versiones, hoy aparece una de la Rolling Stone, de un supuesto plan de una “invasión suave” que está planeando Donald Trump para México con agentes encubiertos, toda una película.",0.0,52,28,11,2024
PREGUNTA,Y le quería preguntar su opinión al respecto.,0.0,8,28,11,2024
PREGUNTA,"Y aprovechando solo este tema, además de su opinión al respecto, que ya ha recibido varias críticas, la oposición se ha atrincherado en una posición de calificar estas medidas como “una forma de estructurar una dictadura”.",0.0,36,28,11,2024
PREGUNTA,"De hecho, cuando usted estaba en Brasil, aquí se dieron la vida para hacer hasta videos hablando de que se necesitaba una intervención de Estados Unidos y Canadá para defender la seguridad y la democracia. Por ahí un líder partidista dijo que “no se puede prometer paz mientras se permita la impunidad”.",0.0,52,28,11,2024
PREGUNTA,"Y pues todo este caldo me lleva a preguntarle: ¿cómo se siente estar al frente de una dictadura comunista, Presidenta?",0.0,20,28,11,2024
PREGUNTA,"Y me gustaría aprovechar que está el secretario general de Sedena para preguntarle: ¿de qué se trata este operativo, si existe tal riesgo de un atentado a la vida del expresidente?",0.0,31,28,11,2024
PREGUNTA,Gracias.,0.0,1,28,11,2024
PREGUNTA, El Chapucero y Efecto Colateral.,0.0,5,28,11,2024
PREGUNTA,"Preguntarle si, ¿ha habido algún obstáculo para poder llegar en el ferrocarril hasta Mexicali?, cuando hay un derecho de vía y, precisamente, también llegaba el tren de pasajeros allá hasta Mexicali.",0.0,31,28,11,2024
PREGUNTA,Gracias.,0.0,1,28,11,2024
PREGUNTA,"Pues, no estaba entre mis tres, pero aprovechando que está el General Trevilla y el Comandante Vallejo. El 15 de abril, el Gobierno de Sonora inició una investigación sobre presuntas irregularidades en el tren que se está construyendo en Ímuris. ¿Si nos podría dar un avance? ¿Qué información tienen ustedes, por favor?",0.0,52,28,11,2024
PREGUNTA," Bueno, va a haber, el proyecto se supone que incluye, pero, bueno, por lo pronto está entre Ímuris.",0.0,18,28,11,2024
PREGUNTA,"Y el problema es este: se le ha llamado “tren fantasma”, que yo no entiendo por qué se le llama así, pero, bueno. Este tren nació en la opacidad y no se daba información. La gente se enteró tarde de que les estaban expropiando, les quitaron sus terrenos; entonces los compraron muy baratos, hablaban de menos de 10 pesos el metro.",0.0,61,28,11,2024
PREGUNTA,"Bueno, independientemente de todos los problemas medioambientales, las afectaciones al jaguar y que ya se ha documentado bastante. En el punto que yo le quiero preguntar sobre la investigación hubo una licitación, se simuló una licitación de la obra y se le dio a la empresa 3PM Obras Civiles y Arquitectónicas, Soluciones en Ingeniería y Construcciones IGHA, CASCAF Operaciones Civiles y Arquitectura, y Decoración y Mantenimiento Inmobiliario ARCO.",0.0,68,28,11,2024
PREGUNTA,Estas empresas simularon ser distintas para ganar la licitación.,0.0,9,28,11,2024
PREGUNTA,"Aquí está involucrado, Presidenta, Heriberto Aguilar, que hoy es senador, y que si usted recordará pues también fue coordinador de su campaña en Sonora, entonces, él es uno. Él firmó este documento donde se simuló esta, presuntamente, esta licitación, habrá que ver qué es lo que dice la investigación.",0.0,49,28,11,2024
PREGUNTA,"Pero me dice que no tiene conocimiento de la investigación; desde el 15 de abril se inició. Y son ya tres empresas… 13 contratos que están opacos y pues, en aras de apelar a que no haya impunidad y que no haya corrupción, que se combata la corrupción.",0.0,48,28,11,2024
PREGUNTA,"El expresidente Andrés Manuel López Obrador, había quedado dar un informe sobre esto con los que tenían la obra, pero ya no hubo tiempo de que se hiciera en los últimos meses. Entonces, ver si… ¿Qué tienen sobre este hecho?",0.0,40,28,11,2024
PREGUNTA,"Incluso hay una empresa que incluso está trabajando en lo del… Aquí en el Plan de Justicia Yaqui, o sea, son una serie de empresas que…",0.0,26,28,11,2024
PREGUNTA, El Universal.,0.0,2,28,11,2024
PREGUNTA,"Usted habla de que atender las causas, el objetivo es que ningún joven, hombre o mujer, se acerque a un grupo delictivo, es el objetivo de atender las causas. Y a mí me parece muy importante; porque usted hablaba también de que no hay drogas sintéticas, bueno, hay consumo de drogas sintéticas, bueno hay consumo de drogas sintéticas en México y es muy grave el consumo de cristal, sobre todo, en la región fronteriza.",0.0,74,28,11,2024
PREGUNTA,"Y bueno, que no se acerquen al grupo delictivo, pero ¿qué pasa con los muchachos que ya están ahí, adolescentes, niños que ya están en las garras de la drogadicción o incluso están combatiendo del lado…? Los utilizan a fuerzas o convencidos de algo, se los llevan también para que estén en las filas de ellos.",0.0,56,28,11,2024
PREGUNTA,"¿Cómo se está trabajando con ellos? ¿En estos casos cómo se van a atender las causas de ellos? ¿Y cómo informaría usted? ¿Cómo mediría si está funcionando este tema de atender las causas? Porque ya ve que lo no se nombra no existe, y lo que no se mide tampoco.",0.0,50,28,11,2024
PREGUNTA,"Entonces, ¿cómo se mediría esto?, ¿y si hay un recurso específico para atender las causas?, que ya usted mencionaba alguna de las causas, pero en este caso ¿qué pasa con estos jóvenes en el consumo de cristal principalmente?",0.0,38,28,11,2024
PREGUNTA,"Y bueno, yo supongo que aquí el General y la gente de seguridad, ya le informó a usted cómo está la situación en las fronteras, cómo estos jóvenes son quizá obligados a irse al consumo o a otra cosa.",0.0,39,28,11,2024
PREGUNTA,"Entonces, para saber ahí cuál es la realidad pues habría que… No sé si tendría que intervenir otra autoridad federal, porque ya está un poco complicado ese caso, sobre todo, porque son menores, y habla de otras varias personas involucradas. Pero en este caso particular este es un menor de 16 años.",0.0,52,28,11,2024
PREGUNTA,"Y en el caso de Sonora, ¿qué se está haciendo ahí con estos jóvenes que ya están atrapados?",0.0,18,28,11,2024
PREGUNTA,"Refería yo el otro día, lástima que no pude preguntarle el otro día en Salud, pero ver si, ¿Salud tiene un programa específico para atender la salud mental de estos jóvenes? Y ayudarles a salir de esa situación. ¿Y si se plantea, por ejemplo, algún centro?, ¿si el Gobierno Federal tiene contemplado algún centro de desintoxicación o de apoyo para ellos, que no sean los centros que ya hay porque están irregulares, o los que son privados, que son muy costosos.",0.0,81,28,11,2024
PREGUNTA,"Entonces, ¿si habrá algo público en ese sentido o cómo se les ayudará en la situación de la salud mental?",0.0,20,28,11,2024
PREGUNTA,"Y lo que había prometido el Presidente López Obrador —o expresidente, como le quieran llamar— es que el pueblo iba a elegir a los jueces, magistrados y ministros. Y él hablaba incluso: si se registran 300 o 20 mil que todos salgan en la boleta. Él ofreció que el pueblo lo iba a elegir, pero llevar a cabo esta promesa o esta intención, pues ya ha derivado en que… Le preguntaba yo el otro día si, ¿realmente el pueblo va a elegir a los jueces, ministros y magistrados? Porque ya pasaron un primer filtro, ya están ahorita veintitantos mil en otro filtro, del Ejecutivo, del Legislativo y del Judicial.",0.0,109,28,11,2024
PREGUNTA,"Y el caso del Judicial… digo, perdón, del Legislativo y del Ejecutivo, Presidenta, la selección que se hizo de estos Comités, pues usted sabe, son personas allegadas al movimiento, a Morena, a la Cuarta Transformación.",0.0,35,28,11,2024
PREGUNTA,"Habría que ver qué tan independientes o qué tan pensantes en el pueblo de México o en los mexicanos van a ser para elegir a estas personas, amén de las personas que se hayan registrado, porque ya hemos visto que se registraron pues algunos que no cumplen con el requisito de la honestidad.",0.0,53,28,11,2024
PREGUNTA,"Pero en el caso, por ejemplo, del Ejecutivo. Usted nombró a Zaldívar, Javier Quijano Baz, Isabel Romero Cruz, Mary Cruz Cortés, Vanessa Romero; son personas allegadas. Y no tendría nada de malo si estuviéramos en los tiempos del PRI, no sería distinto, no lo veríamos, pues, si tienen que ser allegados porque es el PRI, porque es el PAN, pero estamos en tiempos…",0.0,63,28,11,2024
PREGUNTA," La Jornada. Regresando a la llamada con Trump, hubo, ayer hubo discrepancias entre lo que se trató en torno a lo del muro. Quisiera saber: ¿qué fue lo que ocurrió?, ¿qué es lo que realmente se planteó?, porque pareciera que aquí alguien está diciendo algo que no.",0.0,47,28,11,2024
PREGUNTA," La Jornada justamente sobre que pararon el pago de proveedores, a proveedores de Pemex.  ¿Qué información tiene? ¿Si esto está ocurriendo realmente? ¿Y si habrá…?",0.0,25,28,11,2024
PREGUNTA, Hay una mujer ahí.,0.0,4,28,11,2024
