Participante,Texto,Sentimiento,Palabras,Dia,Mes,Anio
PREGUNTA,"Sobre el tema, ¿qué tan complicado o qué tan laborioso ha sido recuperar los valores que se perdieron durante la etapa del neoliberalismo? Y lo planteo de esta manera, porque en muchos de los libros se quitaron materias como lo que fue Civismo, había problemas, incluso, con lo que eran los honores a la bandera.",0.0,55,24,2,2025
PREGUNTA,"Entonces, realmente, ¿cómo fue?, ¿cómo ha sido este proceso de recuperar estos valores, lo que es la historia de México, realmente recuperar toda esta esencia que nos da identidad a los mexicanos? Esa sería mi primera pregunta del tema.",0.0,39,24,2,2025
PREGUNTA,"En una segunda pregunta, Doctora, todo este fin de semana el bloque opositor, contrarios a lo que es su gobierno, se dieron vuelo con el tema del abogado de Juan Pablo Penilla Rodríguez, donde… bueno, intentando relacionarlo con su gobierno, con Morena, incluso, con otros gobiernos. Muestran una foto de un reconocimiento que le fue otorgado en San Lázaro.",0.0,59,24,2,2025
PREGUNTA,"Y bueno, todo esto se lo atribuyeron a su partido, pero ya, conforme va pasando el tiempo, bueno, van saliendo algunas cosas a flote. Una de ellas es de que esta foto que fue mencionada fue hecha en una premiación, en una legislatura pasada. Esto fue a petición de la entonces diputada del PAN, María Teresa Castell, que le otorgó un reconocimiento a Juan Pablo Penilla Rodríguez, como “embajador internacional por la paz”, esto en el Salón Legisladores del Palacio Legislativo.",0.0,81,24,2,2025
PREGUNTA,"Pero, más allá de todo esto, me gustaría conocer su opinión referente precisamente a ¿cómo han estado utilizando la figura de este abogado?, en donde él ya sale a desmentir que no ha tenido ninguna relación con “el Mayo” Zambada y también, incluso, sus abogados también han mencionado esto.",0.0,49,24,2,2025
PREGUNTA,"Todo esto lo han utilizado para empañar su gobierno, pero… pues sí, para hacer ver algo que no es.",0.0,19,24,2,2025
PREGUNTA,Conocer su opinión sobre esto.,0.0,5,24,2,2025
PREGUNTA,"Esta encuesta también, digamos, en el periodo pasado situó al expresidente Andrés Manuel López Obrador como uno de los mandatarios mejor calificados a nivel mundial; usted, prácticamente, está siguiendo esta misma tendencia.",0.0,32,24,2,2025
PREGUNTA,"Y se reconoce a nivel internacional todo lo que ha sido el trabajo de los mandatarios. Aquí están encuestando a la gente, están viendo políticas económicas, políticas sociales. O sea, están aprobando parte de su gobierno o de lo que lleva su gobierno.",0.0,43,24,2,2025
PREGUNTA,También preguntarle ¿qué opinión le merece que sea usted colocada como la mandataria mejor calificada de América?,0.0,17,24,2,2025
PREGUNTA,Ahondando un poco en la pregunta del compañero: quien empezó a circular esta versión acerca del abogado —fue el viernes milimétricamente para que se desarrollara el fin de semana— Anabel Hernández.,0.0,31,24,2,2025
PREGUNTA,"En una segunda pregunta, yéndonos un poquito más allá de México: la salud del Papa Francisco ha decaído considerablemente, según informa el Vaticano…",0.0,23,24,2,2025
PREGUNTA,"Sin embargo, también está pasando un fenómeno bastante interesante, y es que grupos de ultraderecha que, obviamente, muchos de ellos compaginan con el catolicismo, que son católicos, pues mostrando y expresando una alegría, una satisfacción por la caída de la salud de Francisco, ya que lo consideran bastante liberal o progresista y porque, a diferencia de sus antecesores, tal vez no ha condenado o no lo ha cerrado las puertas de la Iglesia católica a grupos que históricamente han sido vulnerables y han sido rechazados como la comunidad LGBT, como las mujeres tal cual, y él ha sido un poco más abierto en ese sentido.",0.0,105,24,2,2025
PREGUNTA,"Entonces, más allá de la declaración o el posicionamiento que pueda tener la Presidenta de México sobre el estado de salud de Francisco, pues nos gustaría escuchar una reflexión acerca de este fenómeno que está pasando, de aquellos que dicen ser religiosos, de aquellos que aseguran tener una afinidad con el catolicismo, pues se estén alegrando o encuentren cierta satisfacción con la caída de la salud de Francisco y ante todo lo que pueda derivar de ello.",0.0,77,24,2,2025
PREGUNTA,"Y para finalizar, la semana pasada —ya que hablaban de la importancia de preservar las lenguas indígenas, las lenguas originarias— aquí en la Ciudad de México sucedió algo interesante: la jefa de gobierno planteó la idea de que en las secundarias se empezase una materia de náhuatl para aproximadamente unas 70 secundarias.",0.0,52,24,2,2025
PREGUNTA,"Y esto generó una serie de comentarios, obviamente, la gran mayoría vinculados a simpatizantes del conservadurismo y de la oposición, en la que señalaban de que no tenían ninguna especie de utilidad enseñar lenguas originarias, náhuatl, para ser precisos, porque en las empresas no es importante, no es un requisito, en empresas estadounidenses ¿quién te va a pedir hablar náhuatl?, ¿no?, te piden hablar inglés.",0.0,65,24,2,2025
PREGUNTA,"Entonces, preguntarle su posición acerca de este asunto como representante del Estado mexicano, ¿cuál es el interés del gobierno naturalmente en preservar, en conservar, pero, sobre todo, para las nuevas generaciones en tener muy presente el tema de las lenguas originarias, los dialectos y demás en la educación pública, Presidenta?",0.0,50,24,2,2025
PREGUNTA," Gracias. Buenos días. Presidenta. Joanna Flores, de Grupo ACIR.",0.0,9,24,2,2025
PREGUNTA,"Preguntarle: sobre el tema de la bandera, decía usted en un inicio que este evento de las 10:00 de la mañana se va a transmitir en escuelas. Si nos pudiera platicar, ¿va a ser a nivel nacional, se va a estar replicando a través de redes sociales?, ¿cómo va a ser? Por favor.",0.0,53,24,2,2025
PREGUNTA, ¿Y va a ser en escuelas públicas o también privadas?,0.0,10,24,2,2025
PREGUNTA,"Y, Presidenta, si me permite hacerle una pregunta al titular de Profeco sobre este tema de las pulseras o estos esquemas donde se paga previamente. Preguntar si, para todas aquellas personas que ya acudieron a algún evento, que tienen todavía saldo, sé que se puede reclamar, pero ¿hay alguna…?, ¿se podrá regresar el tema de la comisión que se pagó previamente o no es un tema retroactivo, digamos?",0.0,68,24,2,2025
PREGUNTA,Si ¿ya en este momento hay algún responsable? Y saber si ¿hay un número determinado de personas que fueron defraudadas por este espectáculo que no ocurrió?,0.0,26,24,2,2025
PREGUNTA, Muchas gracias.,0.0,2,24,2,2025
PREGUNTA,"Presidenta, si me permite también darle a conocer: en Grupo ACIR hemos estado siguiendo un caso sobre un grupo de personas muy amplio, son decenas que fueron defraudadas por una empresa denominada Sinergia, que es una empresa que se dedica a remates bancarios, los ofrece, obviamente, a costos muy atractivos, piden un enganche de entre 200 mil, 300 mil pesos. Hay casos que datan del 2018 en los que no hay ni inmueble y tampoco se les regresa el dinero.",0.0,80,24,2,2025
PREGUNTA,"La persona, el representante legal de esta empresa, prácticamente se burla de las personas diciendo: “Pues presenta tu denuncia, no va a pasar nada”. Efectivamente, hay denuncias penales en un Ministerio Público en la alcaldía Cuauhtémoc, donde no ha habido avances.",0.0,41,24,2,2025
PREGUNTA,"Este grupo de personas ya tuvo recepción en Jefatura de Gobierno, donde se les va a dar apoyo, pero también quisieran estas personas hacerle saber su caso. Saber ¿qué opina y si pudieran tener un apoyo por parte del Gobierno de México?",0.0,42,24,2,2025
PREGUNTA,"Y también, otro tema que también hemos dado seguimiento en Grupo ACIR por 2 años, ya ve que nos gusta dar seguimiento como el Hospital Cuajimalpa, bueno, en Grupo ACIR nuestro compañero…",0.0,32,24,2,2025
PREGUNTA,"Bueno, en este caso le ha tocado a nuestro compañero corresponsal de Chiapas: hace 2 años, en febrero, pierde la vida un niño, el niño Damián, lamentablemente en su colegio.",0.0,30,24,2,2025
PREGUNTA,"Cuando llegan sus papás, encuentran al niño mojado. Ellos tienen la certeza de que el niño murió ahogado; sin embargo, las autoridades de este colegio, la versión era que se atragantó. Se borraron evidencias en su momento.",0.0,37,24,2,2025
PREGUNTA,"Este caso también se expuso al expresidente López Obrador. Él también, bueno, pidió que se le ayudara a esta familia; hubo apoyo, pero pareciera que no hay voluntad, por parte de las autoridades en Chiapas, la Fiscalía, el Poder Judicial.",0.0,40,24,2,2025
PREGUNTA,"Saber también si, ¿pudiera haber un llamado? En este momento, bueno, está el proceso de juicios, pero no hay una sentencia y han pasado 2 años sin que haya justicia para este pequeñito, Presidenta.",0.0,34,24,2,2025
PREGUNTA,"Yo quisiera preguntarle: este fin de semana escuchamos y leímos… Aprovechan los bancos, el sector, todos los sectores a hacer análisis, sobre todo, expectativas de lo que viene. Pero particularmente hubo del sector político algunos señalamientos en el sentido de que no, no cayera usted en el chantaje en este caso de la carta de “El Mayo” Zambada considerándose como una persona cualquiera, cuando pues todavía no es cualquiera, no es cualquier persona.",0.0,73,24,2,2025
PREGUNTA,"Pero esto coincide también con… No caer, por su parte, le aconsejan en este chantaje, también en las amenazas de Trump que fueron recrudecidas: ahora, ya quiere abarcar estos aranceles al sector de los automóviles, semiconductores, farmacéuticos.",0.0,37,24,2,2025
PREGUNTA,"Entonces, un panorama que leen los analistas también del sector económico como difícil de centrar a la atención a los problemas que hay, porque esto podría complicar a su gobierno con el objetivo de la meta que se tiene de disminuir el déficit público del 2 por ciento del PIB cuando están saliendo programas a lo mejor coyunturales.",0.0,58,24,2,2025
PREGUNTA,"Por ejemplo, el trasladar a 10 mil, personal militar a la frontera, esto puede representar gastos al gobierno, programas nuevos que no estaban contemplados, en fin, que al mismo tiempo, ven un escenario difícil, que pueda complicar las finanzas.",0.0,39,24,2,2025
PREGUNTA,"¿Usted qué lectura le da? Y también, ¿qué piensa de esta recomendación de “no caer en un chantaje”, porque esto podría a lo mejor hasta provocar más la ira del presidente Trump?, ¿verdad?",0.0,33,24,2,2025
PREGUNTA,"No sé, Profeco, si tenga operativos contemplados o si esto tenga que ver también con amparos y todo esto, a lo que acudieron, pero lo cierto es que no se ha cumplido este decreto, se siguen vendiendo abiertamente vapeadores; pero, ahora, hasta con la consigna de que ya “hay uno que no produce cáncer” que, incluso, tiene el 90 por ciento de su contenido magnífico para la salud, o sea.",0.0,70,24,2,2025
PREGUNTA,"El caso es de que no se cumple este decreto, se están vendiendo estos en farmacias, en los Oxxos, en tiendas de conveniencia, pues.",0.0,24,24,2,2025
PREGUNTA,"No sé si tenga que ver esto con los amparos, ¿o por qué unos sí y otros no se están vendiendo en el mercado?",0.0,24,24,2,2025
PREGUNTA,"Yo quiero abordar varios temas que tienen que ver con la relación con los Estados Unidos, y en primera instancia, una de las preocupaciones es el tema del fentanilo. Quisiera preguntar si ¿tiene en el gobierno información sobre el consumo de estas drogas o sustancias en nuestro país?, ¿y cuál sería, digamos, el balance a diferencia de lo que ocurre en los Estados Unidos? que allá, dicen, hay una crisis de salud pública.",0.0,73,24,2,2025
PREGUNTA,"En otro tema, bueno, tiene que ver con lo que decía también el presidente Donald Trump respecto del fentanilo; ayer hacía un comentario de que decía “no estamos contentos porque sigue llegando el fentanilo a Estados Unidos y llega a través de México”. También hace una referencia sobre Canadá.",0.0,49,24,2,2025
PREGUNTA,"¿Qué decirle hoy al presidente a unos días, digamos, de que se cumple este plazo y es una de sus exigencias?",0.0,21,24,2,2025
PREGUNTA," ¿Veremos a ese presidente Trump, conforme se acerca la fecha, pues con estas posturas, a diferencia de la semana pasada?",0.0,20,24,2,2025
PREGUNTA,"La última y agradezco mucho sus respuestas. Preguntarle el tema de “El Mayo” Zambada. Decía usted que, si envían cartas, algún ciudadano que pueda estar en algún proceso, se da respuesta.",0.0,31,24,2,2025
PREGUNTA,"En este sentido, en este contexto ¿ya se entró con acciones consulares con “El Mayo” Zambada?, ¿hay ahí algún acercamiento con su equipo legal?, ¿se ha platicado con él al respecto dado que él insiste…?",0.0,35,24,2,2025
PREGUNTA,"Muchas gracias, Presidenta.",0.0,3,24,2,2025
PREGUNTA,"En primer lugar, presentarle, bueno, comentarle y preguntar: si ¿usted ya ha podido ver un asunto que se le trajo aquí, por parte de organizaciones civiles del Proyecto Saguaro? No sé si le suene, es un proyecto que tiene la empresa Mexico Pacific; le estamos dando seguimiento en W Radio.",0.0,50,24,2,2025
PREGUNTA,"Dicen estas personas que para esta construcción que se está planteando de un gasoducto de Sierra Madre y la terminal de licuefacción de gas natural en Saguaro, en donde se asegura que, bueno, se va a afectar a las ballenas y también al clima del Golfo de California.",0.0,48,24,2,2025
PREGUNTA,"Se pretende disminuir los espacios para que entren buques de hasta 300 metros de largo, lo cual —dicen— pone en riesgo la vida de las ballenas. Y también, los ruidos, incluso, puede terminar mucha de esta especie y muchas especies marítimas.",0.0,41,24,2,2025
PREGUNTA,"Saber si ¿usted ha podido ver este asunto? Sabemos que una organización trajo, la organización Nuestro Futuro trajo este tema a la Presidencia, le trajo una petición, que está firmada por 215 mil personas.",0.0,34,24,2,2025
PREGUNTA,"También saber ¿cómo van las pláticas con el gobierno de Estados Unidos?, ¿qué pasó en este acercamiento que tuvo el secretario de Economía, Marcelo Ebrard, con el secretario de Comercio, Howard Lutnick?, ya que se dice, Presidenta, que en este acercamiento se le solicitó a México que imponga unos aranceles de 20 por ciento a China, precisamente, para continuar con los diálogos y evitar el impuesto de 25 por ciento de Estados Unidos.",0.0,73,24,2,2025
PREGUNTA,"Saber si ¿esto es verdad, Presidenta, si ya se le dio respuesta?",0.0,12,24,2,2025
PREGUNTA," ¿Pero México aceptaría esta condicionante de Estados Unidos, Presidenta?",0.0,9,24,2,2025
PREGUNTA,"Lo dijo a través de un comunicado la dirigente de Morena, que se buscó en la base de datos del partido, no se encontró relación, porque se señalaba que había tenido relación directamente con la campaña de usted en 2024.",0.0,40,24,2,2025
PREGUNTA,"Se niega esto; sin embargo, pues hubo unos documentos que presentó Jorge Triana, el panista, donde sí se veía una firma del gobernador de Tamaulipas, Américo Villareal, donde lo llevaba entre sus asesores. Después, él negó, dijo que —bueno— se eliminó de inmediato; sin embargo, bueno la firma ahí está.",0.0,50,24,2,2025
PREGUNTA,"¿Usted va a solicitar o cree que sea necesario que haya una investigación dentro de los equipos tanto de Morena, como a lo mejor de otros gobiernos, si existe realmente una relación con él?",0.0,34,24,2,2025
PREGUNTA,"Usted dice que no lo conoce. Sin embargo, parte de su equipo u otros políticos de las filas de Morena que pueden sí conocerlo, ¿sería necesario llamarlos a investigar que realmente no haya una relación por…? Digo, tras las fotografías que se observa que ha tenido pues algunas… Estuvo presente en algún evento del Presidente López Obrador, en reuniones con legisladores, etcétera.",0.0,62,24,2,2025
PREGUNTA,"Gracias, Presidenta.",0.0,2,24,2,2025
PREGUNTA,"Preguntarle, ya la parte de la elección judicial avanza con la consolidación de la impresión de las boletas, y esta reunión que mantuvieron directivos del INE, la presidenta, junto con la secretaria de Gobernación, el titular de la Secretaría de Seguridad Ciudadana, para consolidar la seguridad del propio proceso.",0.0,49,24,2,2025
PREGUNTA,"¿Qué explicativas ve usted respecto de esta elección? Si, ¿ya no hay obstáculos que puedan afectar el desempeño que pueda tener esta elección para que se lleve a cabo por primera vez el país?",0.0,34,24,2,2025
PREGUNTA,"Y, además, si ¿usted llamaría a los participantes, a los candidatos, candidatas, a estos cargos de elección a tener un comportamiento a la altura del proceso mismo?, ¿algún mensaje que tendría para ellos?",0.0,33,24,2,2025
PREGUNTA," Gracias, Presidenta.",0.0,2,24,2,2025
