Participante,Texto,Sentimiento,Palabras,Dia,Mes,Anio
PREGUNTA,"Preguntarle sobre este tema. Entonces, ¿el compromiso es que habrá el abastecimiento de los medicamentos a partir de marzo de acuerdo a…?",0.0,22,4,2,2025
PREGUNTA," ¿Qué medicamentos son los que ya están llegando, digamos, de estos que nos estaba…? Por favor.",0.0,16,4,2,2025
PREGUNTA," Muchas gracias, subsecretario.",0.0,3,4,2,2025
PREGUNTA,"Presidenta, preguntarle en otro tema, relacionado con asuntos de migración: de acuerdo con la Agencia de Naciones Unidas para los Refugiados en México —y si usted coincide con las cifras—, son cerca de 300 mil los migrantes de otras nacionalidades que están en nuestro país.",0.0,45,4,2,2025
PREGUNTA," Cerca de 300 mil son los que maneja la ACNUR, lo que estaba planteando.",0.0,14,4,2,2025
PREGUNTA,"Entonces, saber ¿si se coincide con estas cifras? ¿Y si hay algún plan para darles atención?, ¿si habrá por parte de la COMAR entrega de documentos?, ¿si va a haber algún programa especial para darles empleo y demás?",0.0,38,4,2,2025
PREGUNTA,"Aprovechando y en tema, digamos, de lo que ocurrió ayer con la pausa de estos aranceles y demás: ¿parte de los planes que tiene o que tenía el gobierno será ir hacia, digamos, otros lugares, otras regiones?, ¿ir preparando las cadenas productivas de México, ante en este tiempo que se tiene, que se logró obtener en el acuerdo ayer con el presidente Trump?",0.0,63,4,2,2025
PREGUNTA," Sí, hoy el escenario es muy distinto.",0.0,7,4,2,2025
PREGUNTA,"Presidenta, también, a propósito de esta llamada telefónica con el presidente Trump. México, digamos, hace el compromiso de blindar de alguna manera, enviar los 10 mil efectivos a la zona fronteriza. ¿Cuál fue el compromiso que hizo Estados Unidos para atender el tema de las armas ilegales que llegan a nuestro país en concreto?",0.0,54,4,2,2025
PREGUNTA,"¿Estos 10 mil se suman, o sea, es decir, estaríamos hablando de 40 mil?",0.0,14,4,2,2025
PREGUNTA,Buenos días a todos.,0.0,4,4,2,2025
PREGUNTA,"Desafortunadamente, Presidenta, se padece también la violencia intrafamiliar entre la comunidad de nuestros hermanos migrantes allá en Estados Unidos, y desgraciadamente ahorita con la situación se alteran muchísimo las familias, hay mucha tensión.",0.0,33,4,2,2025
PREGUNTA,"Entonces, aparte de este aspecto de violencia intrafamiliar, Presidenta, también hay otros aspectos dentro de atención a las familias. Y, bueno, estamos hablando con una población, —imagínense, bueno, usted sabe mejor— tan solo El Salvador tiene 7 millones de habitantes, o sea, estamos hablando de dos, tres países de mexicanos en Estados Unidos.",0.0,53,4,2,2025
PREGUNTA,"Entonces, también dentro de este problema de violencia intrafamiliar está, por ejemplo, el caso de una hermana migrante en Las Vegas, Irma, que denunció en el Consulado esta violencia y, sobre todo, que el papá de sus hijos es deudor. Entonces, denuncia que le entregaron el pasaporte, va y viene de Estados Unidos a México.",0.0,55,4,2,2025
PREGUNTA,"Y, bueno, ¿pues qué se puede hacer en estos casos?",0.0,10,4,2,2025
PREGUNTA,"Dice: “En México no se expide pasaporte a los padres”. Ella me mandó este mensaje, dice: “En México no se expide pasaporte a los padres que deben pensión alimenticia. ¿Qué pasa si un mexicano que es residente en Estados Unidos debe pensión alimenticia y le dan el pasaporte?”",0.0,48,4,2,2025
PREGUNTA,"Entonces, estos son aspectos nuevos, Presidenta, pero, bueno, con el perfil de la 4T, del Humanismo Mexicano, también son aspectos que se deben de revisar.",0.0,25,4,2,2025
PREGUNTA,"Yo estuve en una plática en el Consulado de Orlando, donde estaban dando orientación sobre la violencia intrafamiliar, pero no se ha sistematizado, por parte de los Consulados. Entonces, son aspectos mucho muy importantes.",0.0,34,4,2,2025
PREGUNTA,"Y sobre todo, Presidenta, que este plan para México va a largo plazo, ¿no?, y los gobiernos de Estados Unidos nada más duran cuatro años.",0.0,25,4,2,2025
PREGUNTA,"Entonces, sí me gustaría que usted tuviera presente este caso porque, imagínense, son millones de casos, y se padece esto también allá en Estados Unidos.",0.0,25,4,2,2025
PREGUNTA,"Otro punto también importante, Presidenta, es que, por ejemplo, Rubén, de Utah, me menciona que ha tenido problemas para registrarse con el “botón de pánico” o el “botón rojo”, que le llaman; entonces, me mandó varias dudas, incluso, me mandó que ya ha tenido como seis o siete ocasiones de que quiere registrarse y no ha podido.",0.0,57,4,2,2025
PREGUNTA,"Me manda, dice: “¿Tenemos que contar con los tres requisitos: CURP, pasaporte y matrícula o nos podemos registrar nada más con uno? Yo intenté registrarme y cuando arrojaron mis datos dijo que no eran válidos”.",0.0,35,4,2,2025
PREGUNTA,"Entonces, si ¿habría alguna posibilidad de que aquí, en “La Mañanera”, se pudiera explicar lo del “botón de pánico”?, porque también puede quedar como un programa social…",0.0,27,4,2,2025
PREGUNTA," El botón, perdón, el “botón rojo”, sí. Esos aspectos, Presidenta, ¿cuál es su opinión?",0.0,14,4,2,2025
PREGUNTA," Y ya, por último, Presidenta, en entrevista con la senadora migrante Karina Ruiz, y las diputadas migrantes, entre ellas, la diputada Solache, nos informaron que para renegociación del T-MEC, incluso, bueno, ya hay alguna agenda… no “alguna”, hay una agenda fuerte de hermanos migrantes con la Secretaría de Economía, con la Secretaría de Relaciones Exteriores.",0.0,55,4,2,2025
PREGUNTA,"Y, Presidenta, han revelado negociadores desde el primer Tratado de Libre Comercio con Salinas de Gortari, y ahora, con los de Peña Nieto, anteriores, fíjese que no habían metido la Agenda Migrante, de los hermanos migrantes, y se puede ver en los números, nada más hay como unos 300 mil visas para trabajo.",0.0,53,4,2,2025
PREGUNTA,"Entonces, me dicen ellas, las legisladoras, la senadora y las diputadas, que están armando esta Agenda. ¿Y qué posibilidades habría de que la pudiéramos conocer?  Le digo, esto va a largo plazo y se puede ir trabajando con esta Agenda Migrante a través del T-MEC ya, y meter estos asuntos, Presidenta.",0.0,51,4,2,2025
PREGUNTA, Y que nos informen aquí cómo…,0.0,6,4,2,2025
PREGUNTA," Bueno, muchas gracias, Presidenta.",0.0,4,4,2,2025
PREGUNTA,"El primer tema que me gustaría preguntarle: ¿su opinión sobre estos señalamientos que hacen sobre las reformas, más bien sobre la elección judicial?, que ya muchos están acusando como que “es una, no solamente es un fraude a la Constitución”, porque no se están respetando los procedimientos que tiene la propia Constitución, sino además que “es un fraude” porque Morena está intentando colocar a personas afines a Morena.",0.0,68,4,2,2025
PREGUNTA,"Entonces, ¿qué piensa usted de esos señalamientos, Doctora?",0.0,8,4,2,2025
PREGUNTA," Ok. Por otra parte, Doctora, yo le quiero preguntar sobre estos señalamientos que hizo la Casa Blanca, que, bueno, me parecen muy graves, o sea, el hecho de que hayan dicho de que su gobierno tiene una alianza con los grupos criminales.",0.0,42,4,2,2025
PREGUNTA," Bueno, es que lo quiero es preguntarle, si ¿usted no considera que, así como ha dicho que le va a pedir información al gobierno de Trump sobre la captura del “Mayo” Zambada, no sería también necesario, si usted le pidiera la información, o que le presentara las pruebas, o que aclarara?",0.0,51,4,2,2025
PREGUNTA,"Porque, ¿no considera usted que esto iría en contra, no solamente de la reputación de su gobierno, sino incluso de la reputación del país?",0.0,24,4,2,2025
PREGUNTA," Por otra parte, Doctora, sobre este avión espía que identificó ayer la Secretaría de la Defensa Nacional, esto ¿cómo se podrá…? No sé qué información tenga usted. ¿Y si se pudiera…?",0.0,31,4,2,2025
PREGUNTA,Buenos días a todas y a todos.,0.0,7,4,2,2025
PREGUNTA,"Presidenta, en este desafío que su gobierno ya superó el día de ayer, ha quedado claro que lo importante de esto es salvaguardar la soberanía del país y también los intereses del pueblo mexicano.",0.0,34,4,2,2025
PREGUNTA,"En ese sentido, a mí me gustaría preguntarle acerca de la reforma del maíz. Ello porque el maíz, al ser México el centro de origen de este alimento, que además es el principal alimento de los mexicanos y las mexicanas, tiene un grado también, no solo de soberanía nacional, sino de seguridad alimentaria del mundo, de la humanidad.",0.0,58,4,2,2025
PREGUNTA,"Y, en ese sentido, lo que estamos viendo en la iniciativa de reforma es que se establece una protección frente a maíces transgénicos, pero no frente a maíces genéticamente modificados. Y desde el punto de vista legal y científico no es lo mismo, no es un sinónimo.",0.0,47,4,2,2025
PREGUNTA,"Entonces, quedaría una desprotección frente a otras biotecnologías que no son consideradas transgénicas, pero que sí son genéticamente modificadas, y en ese contexto se abriría una puerta desde el ámbito constitucional porque esta iniciativa de reforma plantea derogar todo lo que tenemos previamente ya establecido en leyes secundarias.",0.0,48,4,2,2025
PREGUNTA,"Y en ese contexto preguntarle, si ¿en esta próxima discusión legislativa podría, esta particularidad, revisarse?",0.0,15,4,2,2025
PREGUNTA,"Atendiendo que las transnacionales utilizarían esta puerta, evidentemente, no en este sexenio, sino en los que siguen, para de alguna manera impulsar permisos para esas otras biotecnologías que son genéticamente modificadas, igual o más dañinas que los transgénicos; como se sabe, estos causan cáncer y además, limitan la propia producción de las semillas.",0.0,53,4,2,2025
PREGUNTA,"Y, ese sentido, Presidenta, preguntarle si, ¿también podría evaluarse la posibilidad de que sí quede establecida ya la prohibición de la siembra de organismos genéticamente modificados para el maíz en la Constitución? Porque tenemos un momento histórico importantísimo con el plan C, que no sabemos, en un futuro, si volvamos a tenerlo con esta mayoría calificada en el Congreso. Y si no es ahora, ¿cuándo? O sea, ¿cuándo podría establecerse esto?",0.0,71,4,2,2025
PREGUNTA,"En ese sentido preguntarle su opinión, Presidenta, sobre todo, si tenemos en cuenta que en el sexenio pasado del Presidente López Obrador y actualmente, la USAID seguía financiando a grupos opositores; el caso particular de Mexicanos Contra la Corrupción y la Impunidad que es esta organización que fundó el empresario Claudio X. González Guajardo; y también varios medios, corporaciones mediáticas y organizaciones que se dedican a generar supuestas investigaciones que, en realidad, muchas de ellas son mentiras.",0.0,77,4,2,2025
PREGUNTA,"Y en este contexto, pues recordar que la propia Unidad de Inteligencia Financiera documentó que la USAID entregó 96 millones a Mexicanos Contra la Corrupción y la Impunidad el sexenio pasado, y que estos fueron utilizados, justo, para tener una incidencia de carácter político en lo que está prohibido por las leyes mexicanas: que gobiernos extranjeros financien a grupos con intereses políticos.",0.0,62,4,2,2025
PREGUNTA,"Y también en ese sentido preguntarle si, ¿no debería de, ya, acabar el financiamiento extranjero? Porque también hay otra agencia que no se menciona todavía, que es la NED, y que sigue financiando opositores.",0.0,34,4,2,2025
PREGUNTA,"Y si Pemex Exploración y Producción, ¿ya tiene una fecha para entregar el crudo sin sal a la refinería Dos Bocas y que esto ya contribuya a la producción de gasolinas?",0.0,31,4,2,2025
PREGUNTA,"Y también, en el caso de la Profeco, pues aquí se dice que van a continuar con las mantas en las gasolineras que cobren de más. En este sentido preguntarle, porque estas estaciones de gasolina y diésel son permisionarias; el Estado les permite que vendan este combustible porque forma parte de un sector estratégico, que es el energético.",0.0,58,4,2,2025
PREGUNTA,"En ese sentido, no solo afectan al consumidor porque cobran de más, sino también ciertas cadenas productivas, y podrían tener incidencia negativa en la estabilidad económica del país.",0.0,28,4,2,2025
PREGUNTA,"Si se está demostrando que hay una colusión, que están coludiéndose, ¿no sería importante, Presidenta, que se le quite ya los permisos a estas gasolineras?, porque al final lo que afectan es mucho más amplio que solo el bolsillo de los usuarios.",0.0,42,4,2,2025
PREGUNTA,Muchas gracias.,0.0,2,4,2,2025
PREGUNTA,"Comenzar, preguntarle: ayer, después de que ya se da este diálogo con el presidente Trump y se suspenden los aranceles, horas más tarde, el presidente de Ecuador, Noboa, anuncia aranceles del 27 por ciento.",0.0,34,4,2,2025
PREGUNTA,Le iba a preguntar ¿si existe algún plan para…?,0.0,9,4,2,2025
PREGUNTA,"Saber, ya que están aquí los titulares del Sector Salud, si ¿hay algún presupuesto, bueno, si ya está contemplado en el presupuesto de este año? Si, ¿hay alguna cifra específica para los hospitales del IMSS, IMSS-Bienestar e ISSSTE?",0.0,38,4,2,2025
PREGUNTA,"Conocer su opinión al respecto y saber si, ¿siente que estas últimas de trabajo justo incidió para que estas encuestas subieran?",0.0,21,4,2,2025
